{
  "type": null,
  "number": "1853",
  "date": "10.05.2021",
  "year": "2021",
  "company_name": "Societatea ANAS GRILL - S.R.L.",
  "meta": {
    "cui": "43924137",
    "legal_type": "SRL",
    "reg_number": "J40/4741/2021",
    "euid": "ROONRC.J40",
    "caen": [
      "1011"
    ],
    "capital": "200 lei, integral vărsat, total părţi sociale: 20 a câte 10 lei fiecare",
    "address": null
  },
  "raw_text": "Societatea ANAS GRILL - S.R.L.\nROMÂNIA\nMINISTERUL JUSTIŢIEI\nOFICIUL NAŢIONAL AL REGISTRULUI COMERŢULUI\nOFICIUL REGISTRULUI COMERŢULUI DE PE LÂNGĂ TRIBUNALUL BUCUREŞTI\nEXTRAS AL REZOLUŢIEI NR. 36121/16.03.2021\nEmilia Ciocea - Persoana desemnată conform art. 11 alin. (1) din O.U.G. nr. 116/2009 pentru instituirea unor măsuri privind activitatea de înregistrare în registrul comerţului, aprobată cu modificări şi completări prin Legea nr. 84/2010, cu modificările şi completările ulterioare\nÎn baza cererii nr. 85574 din data de 11.03.2021 şi a actelor doveditoare depuse, persoana desemnată la Oficiul Registrului Comerţului de pe lângă Tribunalul Bucureşti a dispus autorizarea constituirii, înmatricularea şi înregistrarea societăţii:\n- denumire şi formă. juridică: ANAS GRILL - S.R.L.\n- cod unic de înregistrare: 43924137\n- identificator unic la nivel european (EUID): ROONRC.J40/4741/2021\n- număr de ordine în registrul comerţului: J40/4741/2021\n- sediul social: Bucureşti, sectorul 2, strada Litovoi Voievod nr. 54A, magazie, birou 3\n- domeniul principal de activitate: grupa CAEN:\n101 - Producţia, prelucrarea şi conservarea cărnii şi a produselor din carne;\n- activitate principală:\n1011 - Prelucrarea şi conservarea cărnii\n- capital social: 200 lei, integral vărsat, total părţi sociale: 20 a câte 10 lei fiecare\n- fondator: ALNASHAR MIHAELA, cu domiciliul în oraşul Bragadiru, Strada Verii nr. 18, judeţul Ilfov\n- administrator: ALNASHAR MIHAELA, puteri conferite: depline, cu domiciliul în oraşul Bragadiru, Strada Verii nr. 18, judeţul Ilfov\n- durata de funcţionare: nelimitată.\nDispune publicarea în Monitorul Oficial al României, Partea a IV-a, a prezentului extras.\n(17/6.476.767)",
  "bulletin_id": null,
  "article_id": null,
  "list_parent_classes": null,
  "collapse_id": null,
  "source_href": null
}