{
  "type": null,
  "number": "1853",
  "date": "10.05.2021",
  "year": "2021",
  "company_name": "Societatea IO TRANSFORMATIVE SOLUTIONS - S.R.L.",
  "meta": {
    "cui": "43924994",
    "legal_type": "SRL",
    "reg_number": "J40/4748/2021",
    "euid": "ROONRC.J40",
    "caen": [
      "7022"
    ],
    "capital": "200 lei, integral vărsat",
    "address": null
  },
  "raw_text": "Societatea IO TRANSFORMATIVE SOLUTIONS - S.R.L.\nROMÂNIA\nMINISTERUL JUSTIŢIEI\nOFICIUL NAŢIONAL AL REGISTRULUI COMERŢULUI\nOFICIUL REGISTRULUI COMERŢULUI DE PE LÂNGĂ TRIBUNALUL BUCUREŞTI\nEXTRAS AL REZOLUŢIEI NR. 36186/16.03.2021\nNicoleta Teodorescu - Persoana desemnată conform art. 11 alin. (1) din O.U.G. nr. 116/2009 pentru instituirea unor măsuri privind activitatea de înregistrare în registrul comerţului, aprobată cu modificări şi completări prin Legea nr. 84/2010, cu modificările şi completările ulterioare\nÎn baza cererii nr. 85496 din data de 11.03.2021 şi a actelor doveditoare depuse, persoana desemnată la Oficiul Registrului Comerţului de pe lângă Tribunalul Bucureşti a dispus autorizarea constituirii, înmatricularea şi înregistrarea societăţii:\n- denumire şi formă juridică: IO TRANSFORMATIVE SOLUTIONS - S.R.L.\n- cod unic de înregistrare: 43924994\n- identificator unic la nivel european (EUID): ROONRC.J40/4748/2021\n- număr de ordine în registrul comerţului: J40/4748/2021\n- sediul social: Bucureşti, sectorul 3, Strada Zborului nr. 10, camera 3\n- domeniul principal de activitate: grupa CAEN:\n702 - Activităţi de consultanţă în management\n- activitate principală:\n7022 - Activităţi de consultanţă pentru afaceri şi management\n- capital social: 200 lei, integral vărsat; data vărsării: 11.03.2021, total părţi sociale: 20 a câte 10 lei fiecare\n- fondator: LEAUA IOANA-CRENGUŢA, cu domiciliul în Bucureşti, sectorul 3, Strada Zborului nr. 10\n- administrator: BOLOŞ BRĂDUŢ-VASILE, puteri conferite: depline, cu domiciliul în municipiul Târgu Mureş, strada Koos Ferencz nr. 14, ap. 11, judeţul Mureş\n- durata de funcţionare: nelimitată.\nDispune publicarea în Monitorul Oficial al României, Partea a IV-a, a prezentului extras.\n(21/6.476.773)",
  "bulletin_id": null,
  "article_id": null,
  "list_parent_classes": null,
  "collapse_id": null,
  "source_href": null
}