{
  "type": null,
  "number": "1853",
  "date": "10.05.2021",
  "year": "2021",
  "company_name": "Societatea CUTHTRANS - S.R.L.",
  "meta": {
    "cui": "16082686",
    "legal_type": "SRL",
    "reg_number": "J24/110/2004",
    "euid": null,
    "caen": [],
    "capital": null,
    "address": "în mun. Sighetu Marmaţiei, str. Rodnei nr. 29, jud. Maramureş, CNP xxxxxxxxxxxxx, şi GIURGI IOAN"
  },
  "raw_text": "Societatea CUTHTRANS - S.R.L.\nHOTĂRÂREA NR. 1/15.03.2021\nSubsemnatul, ŞIMAI ARTUR, domiciliat în mun. Sighetu Marmaţiei, str. Rodnei nr. 29, jud. Maramureş, CNP xxxxxxxxxxxxx, şi GIURGI IOAN, domiciliat în mun. Sighetu Marmaţiei, Piaţa 1 Decembrie 1918, bl. 35, sc. 1, et. 1, ap. 5, jud. Maramureş, CNP xxxxxxxxxxxxx,\nasociaţi la CUTHTRANS - S.R.L., cu sediul în mun. Sighetu Marmaţiei, str. Rodnei nr. 29, judeţul Maramureş, înregistrată la ORC cu nr. J24/110/2004, CUI 16082686, am hotărât:\n1. Cesionarea de către dl GIURGI IOAN a întregii sale cote de capital social de 10 lei, respectiv o parte socială, către coasociatul ŞIMAI ARTUR.\n2. Reducerea valorii unei părţi sociale de la 10 lei la 1 leu.\n3. Cesionarea de către dl ŞIMAI ARTUR a 4 părţi sociale a 1 leu fiecare, în cote egale de o parte socială fiecare, către:\n- ALEXANDROVICS GHEORGHE NORBERT, cetăţean român, născut la data de 16.10.1980 în mun. Sighetu Marmaţiei, judeţul Maramureş, cu domiciliul în mun. Sighetu Marmaţiei, str. Bradului, bl. 1, sc. 1, et. 3, ap. 14, judeţ Maramureş, posesor al CI seria MM nr. 570860, eliberată de SPCLEP Sighetu Marmaţiei la data de 20.09.2011, CNP xxxxxxxxxxxxx;\n- ŞIMAI GABRIELA, cetăţean român, născută la data de 20.12.1979 în mun. Sighetu Marmaţiei, judeţ Maramureş, cu domiciliul în satul Şieu, com. Şieu, nr. 943, judeţ Maramureş, posesoare a CI seria XM nr. 016626, eliberată de SPCLEP Rozavlea la data de 16.01.2020, CNP xxxxxxxxxxxxx;\n- FILIP SORIN, cetăţean român, născut la data de 21.08.1973 în mun. Sighetu Marmaţiei, judeţ Maramureş, cu domiciliul în mun. Sighetu Marmaţiei, str. Tractorului nr. 51, judeţ Maramureş, posesor al CI seria MM nr. 739425, eliberată de SPCLEP Sighetu Marmaţiei la data de 18.06.2014, CNP xxxxxxxxxxxxx;\n- VLAD CRISTIAN-IOAN, cetăţean român, născut la data de 29.10.1975 în mun. Sighetu Marmaţiei, judeţ Maramureş, cu domiciliul în mun. Sighetu Marmaţiei, str. Constantin Dobrogeanu Gherea nr. 46, judeţ Maramureş, posesor al CI seria MM nr. 702573, eliberată de SPCLEP Sighetu Marmaţiei la data de 24.10.2013, CNP xxxxxxxxxxxxx.\nCesiunile s-au realizat la valoarea nominală de 1 leu/parte socială, fără a aduce venituri impozabile.\n4. Ca urmare a modificărilor capitalul social este de 230 RON, divizat în 230 părţi sociale a 1 leu fiecare, şi se repartizează între asociaţi astfel:\n- ŞIMAI ARTUR - 226 RON, echivalând cu 226 părţi sociale, respectiv 98,26%;\n- ALEXANDROVICS GHEORGHE NORBERT - 1 RON, echivalând cu o parte socială, respectiv 0,435%;\n- ŞIMAI GABRIELA - 1 RON, echivalând cu o parte socială, respectiv 0,435%;\n- FILIP SORIN - 1 RON, echivalând cu o parte socială, respectiv 0,435%;\n- VLAD CRISTIAN-IOAN - 1 RON, echivalând cu o parte socială, respectiv 0,435%.\n5. Participarea la profit şi pierderi se va face proporţional cu cotele de participare la capitalul social.\n6. Mandatul administratorului ŞIMAI ARTUR va fi pe 50 de ani.\n7. Numirea în calitate de administratori a dlor ALEXANDROVICS GHEORGHE NORBERT, FILIP SORIN, VLAD CRISTIAN-IOAN şi a dnei ŞIMAI GABRIELA, cu puteri depline în relaţiile cu terţii şi cu mandat pe 50 de ani. Administrarea societăţii se va face separat de către toţi administratorii.\n8. Se modifică art. 11 din actul constitutiv, acesta urmând să aibă următorul conţinut: \"Hotărârile asociaţilor se iau în adunarea generală care reprezintă ¾ din nr. total al asociaţilor. Votul este deschis sau prin corespondenţă. Adunările generale sunt ordinare şi extraordinare.\"\n9. Se modifică art. 13 din actul constitutiv, acesta urmând să aibă următorul conţinut: \"Pentru hotărârile având ca obiect modificarea actului constitutiv este necesar votul a ¾ din nr. total al asociaţilor.\nCelelalte clauze ale actelor de constituire şi următoarele rămân neschimbate.\nPrezentul act a fost tehnoredactat în 2 exemplare.\n(6/6.476.075)",
  "bulletin_id": null,
  "article_id": null,
  "list_parent_classes": null,
  "collapse_id": null,
  "source_href": null
}