{
  "type": "Notificare",
  "number": "1853",
  "date": "10.05.2021",
  "year": "2021",
  "company_name": "Societatea BONJOUR BEST SALE - S.R.L.",
  "meta": {
    "cui": "36753832",
    "legal_type": "SRL",
    "reg_number": "J33/1419/2016",
    "euid": "ROONRC.J33",
    "caen": [],
    "capital": null,
    "address": "în municipiul Suceava, Strada Narciselor nr. 2, bloc 2, scara A, ap. 54, judeţul Suceava"
  },
  "raw_text": "Societatea BONJOUR BEST SALE - S.R.L.\nNOTIFICARE\nOficiul Registrului Comerţului de pe lângă Tribunalul Suceava notifică, în conformitate cu prevederile art. 204 alin. (5) din Legea nr. 31/1990, republicată, cu modificările şi completările ulterioare, depunerea textului actualizat al actului constitutiv al Societăţii Comerciale BONJOUR BEST SALE - S.R.L., cu sediul în municipiul Suceava, Strada Narciselor nr. 2, bloc 2, scara A, ap. 54, judeţul Suceava, înregistrată sub nr. J33/1419/2016, identificator unic la nivel european ROONRC.J33/1419/2016, cod unic de înregistrare 36753832, care a fost înregistrat sub nr. 13936 din 13.04.2021.\n(14/6.518.346)",
  "bulletin_id": null,
  "article_id": null,
  "list_parent_classes": null,
  "collapse_id": null,
  "source_href": null
}