{
  "type": "Notificare",
  "number": "1853",
  "date": "10.05.2021",
  "year": "2021",
  "company_name": "Societatea SALMED - S.R.L.",
  "meta": {
    "cui": "19088225",
    "legal_type": "SRL",
    "reg_number": "J12/3346/2006",
    "euid": "ROONRC.J12",
    "caen": [],
    "capital": null,
    "address": "în municipiul Cluj-Napoca, strada Zaharia Carcalechi nr. 3, judeţul Cluj"
  },
  "raw_text": "Societatea SALMED - S.R.L.\nNOTIFICARE\nOficiul Registrului Comerţului de pe lângă Tribunalul Cluj notifică, în conformitate cu prevederile art. 204 alin. (5) din Legea nr. 31/1990, republicată, cu modificările şi completările ulterioare, depunerea textului actualizat al actului constitutiv al Societăţii Comerciale SALMED - S.R.L., cu sediul în municipiul Cluj-Napoca, strada Zaharia Carcalechi nr. 3, judeţul Cluj, înregistrată sub nr. J12/3346/2006, identificator unic la nivel european ROONRC.J12/3346/2006, cod unic de înregistrare 19088225, care a fost înregistrat sub nr. 31258 din 12.04.2021.\n(24/6.514.792)",
  "bulletin_id": null,
  "article_id": null,
  "list_parent_classes": null,
  "collapse_id": null,
  "source_href": null
}