{
  "type": "Notificare",
  "number": "1853",
  "date": "10.05.2021",
  "year": "2021",
  "company_name": "Societatea WIMAXXED EXPERT - S.R.L.",
  "meta": {
    "cui": "18208897",
    "legal_type": "SRL",
    "reg_number": "J23/2160/2016",
    "euid": "ROONRC.J23",
    "caen": [],
    "capital": null,
    "address": null
  },
  "raw_text": "Societatea WIMAXXED EXPERT - S.R.L.\nNOTIFICARE\nOficiul Registrului Comerţului Ilfov de pe lângă Tribunalul Ilfov notifică, în conformitate cu prevederile art. 204 alin. (5) din Legea nr. 31/1990, republicată, cu modificările şi completările ulterioare, depunerea textului actualizat al actului constitutiv al Societăţii Comerciale WIMAXXED EXPERT - S.R.L., cu sediul în comuna Dobroeşti, strada Nicolae Bălcescu nr. 111, lotul 2, mansardă, judeţul Ilfov, înregistrată sub nr. J23/2160/2016, identificator unic la nivel european ROONRC.J23/2160/2016, cod unic de înregistrare 18208897, care a fost înregistrat sub nr. 22613 din 16.03.2021.\n(1/6.475.988)",
  "bulletin_id": null,
  "article_id": null,
  "list_parent_classes": null,
  "collapse_id": null,
  "source_href": null
}