{
  "type": "Notificare",
  "number": "1853",
  "date": "10.05.2021",
  "year": "2021",
  "company_name": "Societatea BOA RBT - S.R.L.",
  "meta": {
    "cui": "32866391",
    "legal_type": "SRL",
    "reg_number": "J2/250/2014",
    "euid": "ROONRC.J2",
    "caen": [],
    "capital": null,
    "address": "în municipiul Arad, strada IV nr. 13, Zona Industrială Nord-Vest, judeţul Arad"
  },
  "raw_text": "Societatea BOA RBT - S.R.L.\nNOTIFICARE\nOficiul Registrului Comerţului de pe lângă Tribunalul Arad notifică, în conformitate cu prevederile art. 204 alin. (5) din Legea nr. 31/1990, republicată, cu modificările şi completările ulterioare, depunerea textului actualizat al actului constitutiv al societăţii comerciale BOA RBT - S.R.L., cu sediul în municipiul Arad, strada IV nr. 13, Zona Industrială Nord-Vest, judeţul Arad, înregistrată sub nr. J2/250/2014, identificator unic la nivel european ROONRC.J2/250/2014, cod unic de înregistrare 32866391, care a fost înregistrat sub nr. 13933 din 15.04.2021.\n(50/6.518.088)",
  "bulletin_id": null,
  "article_id": null,
  "list_parent_classes": null,
  "collapse_id": null,
  "source_href": null
}