{
  "type": "Notificare",
  "number": "1853",
  "date": "10.05.2021",
  "year": "2021",
  "company_name": "Societatea CASA NOASTRA - S.R.L.",
  "meta": {
    "cui": "7510066",
    "legal_type": "SRL",
    "reg_number": "J16/857/1995",
    "euid": "ROONRC.J16",
    "caen": [],
    "capital": null,
    "address": "în satul Pieleşti, comuna Pieleşti, Calea Bucureşti nr. 113, judeţul Dolj"
  },
  "raw_text": "Societatea CASA NOASTRA - S.R.L.\nNOTIFICARE\nOficiul Registrului Comerţului de pe lângă Tribunalul Dolj notifică, în conformitate cu prevederile art. 204 alin. (5) din Legea nr. 31/1990, republicată, cu modificările şi completările ulterioare, depunerea textului actualizat al actului constitutiv al societăţii comerciale CASA NOASTRA - S.R.L., cu sediul în satul Pieleşti, comuna Pieleşti, Calea Bucureşti nr. 113, judeţul Dolj, înregistrată sub nr. J16/857/1995, identificator unic la nivel european ROONRC.J16/857/1995, cod unic de înregistrare 7510066, care a fost înregistrat sub nr. 4355 din 26.01.2021.\n(33/6.516.710)",
  "bulletin_id": null,
  "article_id": null,
  "list_parent_classes": null,
  "collapse_id": null,
  "source_href": null
}