{
  "type": "Notificare",
  "number": "1853",
  "date": "10.05.2021",
  "year": "2021",
  "company_name": "Societatea MEDMARA BRAVO - S.R.L.",
  "meta": {
    "cui": "39308317",
    "legal_type": "SRL",
    "reg_number": "J26/715/2018",
    "euid": "ROONRC.J26",
    "caen": [],
    "capital": null,
    "address": "în municipiul Târgu Mureş, strada Cuza Vodă nr. 22, ap. 14, judeţul Mureş"
  },
  "raw_text": "Societatea MEDMARA BRAVO - S.R.L.\nNOTIFICARE\nOficiul Registrului Comerţului de pe lângă Tribunalul Mureş notifică, în conformitate cu prevederile art. 204 alin. (5) din Legea nr. 31/1990, republicată, cu modificările şi completările ulterioare, depunerea textului actualizat al actului constitutiv al Societăţii Comerciale MEDMARA BRAVO - S.R.L., cu sediul în municipiul Târgu Mureş, strada Cuza Vodă nr. 22, ap. 14, judeţul Mureş, înregistrată sub nr. J26/715/2018, identificator unic la nivel european ROONRC.J26/715/2018, cod unic de înregistrare 39308317, care a fost înregistrat sub nr. 10438 din 16.03.2021.\n(15/6.476.088)",
  "bulletin_id": null,
  "article_id": null,
  "list_parent_classes": null,
  "collapse_id": null,
  "source_href": null
}