{
  "type": null,
  "number": "1853",
  "date": "10.05.2021",
  "year": "2021",
  "company_name": "Societatea EVEREST COACHING - S.R.L.",
  "meta": {
    "cui": "43924188",
    "legal_type": "SRL",
    "reg_number": "J40/4745/2021",
    "euid": "ROONRC.J40",
    "caen": [
      "8559"
    ],
    "capital": "200 lei, integral vărsat, total părţi sociale: 20 a câte 10 lei fiecare",
    "address": null
  },
  "raw_text": "Societatea EVEREST COACHING - S.R.L.\nROMÂNIA\nMINISTERUL JUSTIŢIEI\nOFICIUL NAŢIONAL AL REGISTRULUI COMERŢULUI\nOFICIUL REGISTRULUI COMERŢULUI DE PE LÂNGĂ TRIBUNALUL BUCUREŞTI\nEXTRAS AL REZOLUŢIEI NR. 36114/16.03.2021\nEmma Mădălina Leonida - Persoana desemnată conform art. 11 alin. (1) din O.U.G. nr. 116/2009 pentru instituirea unor măsuri privind activitatea de înregistrare în registrul comerţului, aprobată cu modificări şi completări prin Legea nr. 84/2010, cu modificările şi completările ulterioare\nÎn baza cererii nr. 83328 din data de 10.03.2021 şi a actelor doveditoare depuse, persoana desemnată la Oficiul Registrului Comerţului de pe lângă Tribunalul Bucureşti a dispus autorizarea constituirii, înmatricularea şi înregistrarea societăţii:\n- denumire şi formă juridică EVEREST COACHING - S.R.L.\n- cod unic de înregistrare: 43924188\n- identificator unic la nivel european (EUID): ROONRC.J40/4745/2021\n- număr de ordine în registrul comerţului: J40/4745/2021\n- sediul social: Bucureşti, sectorul 5, Bulevardul Libertăţii nr. 20, bloc 103, scara 1, etaj 4, ap. 10\n- domeniul principal de activitate: grupa CAEN:\n855 - Alte forme de învăţământ\n- activitate principală:\n8559 - Alte forme de învăţământ n.c.a.\n- capital social: 200 lei, integral vărsat, total părţi sociale: 20 a câte 10 lei fiecare\n- fondator: BUCULEI AUREL, cu domiciliul în Bucureşti, sectorul 5, Bulevardul Libertăţii nr. 20, bloc 103, scara 1, etaj 4, ap. 10\n- administrator: BUCULEI AUREL, puteri conferite: depline, cu domiciliul în Bucureşti, sectorul 5, Bulevardul Libertăţii nr. 20, bloc 103, scara 1, etaj 4, ap. 10\n- durata de funcţionare: nedeterminată.\nDispune publicarea în Monitorul Oficial al României, Partea a IV-a, a prezentului extras.\n(19/6.476.770)",
  "bulletin_id": null,
  "article_id": null,
  "list_parent_classes": null,
  "collapse_id": null,
  "source_href": null
}