{
  "type": "Notificare",
  "number": "1853",
  "date": "10.05.2021",
  "year": "2021",
  "company_name": "Societatea OBERCONS COMP - S.R.L.",
  "meta": {
    "cui": "33979666",
    "legal_type": "SRL",
    "reg_number": "J17/57/2015",
    "euid": "ROONRC.J17",
    "caen": [],
    "capital": null,
    "address": "în municipiul Galaţi, calea Smârdan nr. 2, camera 19, etaj 2, judeţul Galaţi"
  },
  "raw_text": "Societatea OBERCONS COMP - S.R.L.\nNOTIFICARE\nOficiul Registrului Comerţului de pe lângă Tribunalul Galaţi notifică, în conformitate cu prevederile art. 204 alin. (5) din Legea n-. 31/1990, republicată, cu modificările şi completările ulterioare, depunerea textului actualizat al actului constitutiv al Societăţii Comerciale OBERCONS COMP - S.R.L., cu sediul în municipiul Galaţi, calea Smârdan nr. 2, camera 19, etaj 2, judeţul Galaţi, înregistrată sub nr. J17/57/2015, identificator unic la nivel european ROONRC.J17/57/2015, cod unic de înregistrare 33979666, care a fost înregistrat sub nr. 18856 din 13.04.2021.\n(55/6.518.178)",
  "bulletin_id": null,
  "article_id": null,
  "list_parent_classes": null,
  "collapse_id": null,
  "source_href": null
}