{
  "type": null,
  "number": "1853",
  "date": "10.05.2021",
  "year": "2021",
  "company_name": "Societatea DEDEGEORGI FAMILY - S.R.L.",
  "meta": {
    "cui": "43933658",
    "legal_type": "SRL",
    "reg_number": "J23/1749/2021",
    "euid": "ROONRC.J23",
    "caen": [
      "5610"
    ],
    "capital": "200 lei, integral vărsat, total părţi sociale: 20 a câte 10 lei fiecare",
    "address": null
  },
  "raw_text": "Societatea DEDEGEORGI FAMILY - S.R.L.\nROMÂNIA\nMINISTERUL JUSTIŢIEI\nOFICIUL NAŢIONAL AL REGISTRULUI COMERŢULUI\nOFICIUL REGISTRULUI COMERŢULUI DE PE LÂNGĂ TRIBUNALUL ILFOV\nEXTRAS AL REZOLUŢIEI NR. 8442/17.03.2021\nLuminiţa Dobrogeanu - Persoană desemnată conform art. 11 alin. (1) din O.U.G. nr. 116/2009 pentru instituirea\nunor măsuri privind activitatea de înregistrare în registrul comerţului, aprobată cu modificări şi completări prin Legea nr. 84/2010, cu modificările şi completările ulterioare\nÎn baza cererii nr. 22343 din data de 16.03.2021 şi a actelor doveditoare depuse, persoana desemnată la Oficiul Registrului Comerţului de pe lângă Tribunalul Ilfov a dispus autorizarea constituirii, înmatricularea şi înregistrarea societăţii:\n- denumire şi formă juridică: DEDEGEORGI FAMILY - S.R.L.;\n- cod unic de înregistrare: 43933658;\n- identificator unic la nivel european (EUID): ROONRC.J23/1749/2021;\n- număr de ordine în registrul comerţului: J23/1749/2021;\n- sediul social. satul Tunari, comuna Tunari, Strada Garoafelor nr. 41, judeţul Ilfov;\n- domeniul principal de activitate. grupa CAEN: 561 - Restaurante;\n- activitate principală:\n5610 - Restaurante;\n- capital social: 200 lei, integral vărsat, total părţi sociale: 20 a câte 10 lei fiecare;\n- fondatori:\n1. RĂILEANU ROXANA-MIHAELA, cu domiciliul în satul Tunari, comuna Tunari, Strada Garoafelor nr. 41, judeţul Ilfov;\n2. RĂILEANU GEORGE-ALEXANDRU, cu domiciliul în satul Tunari, comuna Tunari, Strada Garoafelor nr. 41, judeţul Ilfov;\n- administratori:\n1. RĂILEANU GEORGE-ALEXANDRU, puteri conferite: depline exercitate conf. act constitutiv, cu domiciliul în satul Tunari, comuna Tunari, Strada Garoafelor nr. 41, judeţul Ilfov;\n2. RĂILEANU ROXANA-MIHAELA, puteri conferite: depline exercitate conf. act constitutiv, cu domiciliul în satul Tunari, comuna Tunari, Strada Garoafelor nr. 41, judeţul Ilfov;\n- durata de funcţionare: nelimitată.\nDispune publicarea în Monitorul Oficial al României, Partea a IV-a, a prezentului extras.\n(2/6.476.027)",
  "bulletin_id": null,
  "article_id": null,
  "list_parent_classes": null,
  "collapse_id": null,
  "source_href": null
}