{
  "type": "Notificare",
  "number": "1853",
  "date": "10.05.2021",
  "year": "2021",
  "company_name": "Societatea DOTLUMEN - S.R.L.",
  "meta": {
    "cui": "42260316",
    "legal_type": "SRL",
    "reg_number": "J12/562/2020",
    "euid": null,
    "caen": [],
    "capital": null,
    "address": "în mun. Bucureşti, sectorul 6"
  },
  "raw_text": "Societatea DOTLUMEN - S.R.L.\nHOTĂRÂREA NR. 09 din 01.03.2021\na Adunării Generale Extraordinare a Asociaţilor S.C. DOTLUMEN - S.R.L.\n1. CORNEL MARIAN AMARIEI, cetăţean român, născut în mun. Bucureşti, sectorul 6, la data de 09.09.1993, domiciliat în satul Floreşti, (comuna Floreşti- Stoieneşti), str. Mihai Viteazul nr. 3, judeţul Giurgiu, identificat cu CI seria GG număr 482151, eliberată de SPCLEP Bolintin-Vale la data de 10.10.2018, valabilă până la 09.09.2028, CNP xxxxxxxxxxxxx;\n2. GABRIEL CHINDRIŞ, cetăţean român, născut în mun. Bistriţa, judeţul Bistriţa-Năsăud, la data de 15.11.1973, domiciliat în judeţul Cluj, satul Feleacu (com. Feleacu), nr. 181A, identificat cu CI seria CJ nr. 519100, eliberată de către SPCLEP Cluj la data de 19.11.2020, valabilă până la 15.11.2030, având CNP xxxxxxxxxxxxx;\n3. MIHAI IVAŞCU, cetăţean român, născut la data de 08.02.1988 în jud. Teleorman, mun. Alexandria, domiciliat în mun. Bucureşti, sectorul 3, Cal. Călăraşi nr. 244, bl. S21, sc. 3, et. 2, ap. 74, identificat cu CI seria RD nr. 883991, CNP xxxxxxxxxxxxx, eliberată de către SPCEP Sector 3 la data de 28.07.2017, valabilă până la 08.02.2027;\n4. SORIN SURU, cetăţean român, născut la data de 28.03.1964 în mun. Timişoara, jud. Timiş, domiciliat în mun. Timişoara, jud. Timiş, str. Horia Creangă nr. 17, identificat cu CI seria TM nr. 887895, CNP xxxxxxxxxxxxx, eliberată de către SPCLEP Timişoara la data de 18.03.2011, valabilă până la 28.03.2021;\n5. RĂZVAN RAŢ-DINCĂ, cetăţean român, născut la data de 26.05.1981 în mun. Slatina, judeţul Olt, domiciliat în oraşul Piatra-Olt, judeţul Olt, Str. Victoriei nr. 19, identificat cu CI seria OT nr. 666937, CNP xxxxxxxxxxxxx, eliberată de către SPCLEP Piatra-Olt la data de 25.04.2014, valabilă până la 26.05.2024;\n6. IULIIA RAŢ-DINCĂ, cetăţean ucrainean, născută la data de 25.04.1983 în Estonia, domiciliată în oraşul Voluntari, str. Erou N. Iancu nr. 751/12, sc. C, ap. C8, judeţul Ilfov, identificată cu paşaport tip P nr. PU 359321, emis la data de 09.04.2019 şi valabil până la 09.04.2029 de către 2 ROU şi permis de şedere temporară nr. RO0491648, emis la data de 09.05.2018 şi valabil până la 08.05.2023;\n7. MAGOMED ALIEV, cetăţean rus, născut la data de 08.02.1997 în Moscova, Federaţia Rusă, identificat prin paşaport tip P nr. 55 0367871, eliberat de către M Д POCC 07701 la data de 31.03.2020, valabil până la data de 31.03.2030 şi carte de rezident nr. OD 061408, emisă la data de 01.10.2019, valabilă până la 17.09.2022, emisă de către Le Directeur de la Surete Publique, având reşedinţa în 7 avenue Princesse Grace, Monaco;\n8. ANZOR ALIEV, cetăţean rus, născut la data de 29.07.1968 în Urus-Martan, Federaţia Rusă, identificat prin paşaport tip P nr. 75 6015979, eliberat de către ФMC 77117 la data de 19.09.2017, valabil până la 19.09.2027 şi carte de rezident nr. OD 060464, emisă la data de 09.09.2019, valabilă până la data de 17.09.2022, emisă de către Le Directeur de la Surete Publique, având reşedinţa în 7 avenue Princesse Grace, Monaco;\n9. SHAIKH OMAR SAQER MOHAMMED ALQASSIMI, membru al familiei domnitoare şi cetăţean al Ras Al Khaimah, Emiratele Arabe Unite, născut la 10.12.1957 în Ras Alkhaimah, domiciliat în Emiratele Arabe Unite, Ras Al Khaimah, strada Khuzam Street, Khuzam Palace, Shaikh Omar AlQassimi Office, identificat prin paşaport nr. 383C47382, emis la 23.11.2015 de către Abu Dhabi şi valabil până la 22.11.2020,\ndenumiţi în mod colectiv \"Asociaţii\", asociaţi deţinând 100% părţile sociale în următoarea societate:\nDOTLUMEN - S.R.L., funcţionând în conformitate cu legile din România, cu sediul în Cluj-Napoca, str. Haller Karoly nr. 10, etaj 1, camera 10, judeţul Cluj, reprezentată de către GABRIEL CHINDRIŞ şi CORNEL MARIAN\nAMARIEI, în calitate de administratori, având număr de înregistrare la Oficiul Registrului Comerţului de pe lângă Tribunalul Cluj J12/562/2020 şi CUI 42260316,\ndenumită în continuare \"Societatea\", şi\n1. EDGAR JOHAN LOUIS CHRISTIAAN REIJTENBAGH, cetăţean olandez, născut la data de 21.09.1977, având domiciliul în Monaco, Villa Mascotte, Rue des Giroflees nr. 3, 9800 Monaco, identificat cu paşaport nr. BVDR451P1, eliberat de către Burg van Gameente Haarlemmermeer, în data de 21.04.2014, valabil până la 21.04.2024,\n2. S.C. ASCENDIS CONSULTING - S.R.L., funcţionând în conformitate cu legile din România, cu sediul în Bucureşti, sectorul 1, str. Ion Ionescu de la Brad nr. 2B, la parterul Complexului de Birouri \"Gabrielle Center\"; tronson I, camera 2, reprezentată de către GOSU ANDREI EUGEN, în calitate de administrator, având număr de înregistrare la Oficiul Registrului Comerţului de pe lângă Tribunalul Bucureşti J40/3140/1997 şi CUI 9398288,\n3. S.C. ULPIA VENTURES - S.R.L., funcţionând în conformitate cu legile din România, cu sediul în Bucureşti, sectorul 1, Piaţa Montreal nr. 10, în incinta Clădirii World Trade Center, Bucureşti, intrarea D, camera nr. 1.10, etaj 1, reprezentată de către MARINESCU CĂTĂLIN-VALENTIN, în calitate de administrator, având număr de înregistrare la Oficiul Registrului Comerţului de pe lângă Tribunalul Bucureşti J40/15139/2016 şi CUI 36749688.\nîn calitate de investitori, denumiţi în continuare \"Viitorii Asociaţi\",\nhotărăsc cu unanimitate de voturi, în cadrul adunării generale extraordinare a asociaţilor de astăzi, 01.03.2021, următoarele:\n1. Aprobarea cesionării de către asociatul MIHAI IVAŞCU către asociatul RĂZVAN RAŢ-DINCĂ a participaţiei de 20 de părţi sociale, cu o valoare nominală de 10 lei fiecare şi o valoare totală de 200 lei, reprezentând 1,41643% din capitalul social al Societăţii, în condiţiile contractului de cesiune părţi sociale.\n2. Aprobarea dobândirii de către asociatul RĂZVAN RAŢ-DINCĂ de la asociatul MIHAI IVAŞCU a participaţiei de 20 de părţi sociale, cu o valoare nominală de 10 lei fiecare şi o valoare totală de 200 lei, reprezentând 1,41643% din capitalul social al Societăţii.\nAstfel, ca urmare a cesiunii părţilor sociale, structura capitalului social va fi următoarea:\n• CORNEL MARIAN AMARIEI, cetăţean român, născut în mun. Bucureşti, sectorul 6, la data de 09.09.1993, domiciliat în satul Floreşti (comuna Floreşti- Stoieneşti), str. Mihai Viteazul nr. 3, judeţul Giurgiu, posesor al CI seria GG număr 482151, eliberată de SPCLEP Bolintin-Vale la data de 10.10.2018, valabilă până la 09.09.2028, CNP xxxxxxxxxxxxx, cu un aport de 7.000 lei, împărţit în 700 părţi sociale a câte 10 lei fiecare, reprezentând 49,575071% din capitalul social al Societăţii;\n• GABRIEL CHINDRIŞ, cetăţean român, născut în mun. Bistriţa, judeţul Bistriţa-Năsăud, la data de 15.11.1973, domiciliat în judeţul Cluj, mun. Cluj-Napoca, str. Cardinal Iuliu Hossu nr. 63, ap. 21, identificat cu CI seria KX nr. 750275, eliberată de către SPCLEP Cluj- Napoca la data de 06.07.2010, valabilă până la 15.11.2020, având CNP xxxxxxxxxxxxx, cu un aport de 3.00 lei, împărţit în 300 părţi sociale a câte 10 lei fiecare, reprezentând 21,246459% din capitalul social al Societăţii;\n• MIHAI IVAŞCU, cetăţean român, născut la data de 08.02.1988 în jud. Teleorman, mun. Alexandria, domiciliat în mun. Bucureşti, sectorul 3, Calea Călăraşi nr. 244, bl. S21, sc. 3, et. 2, ap. 74, identificat cu CI seria RD nr. 883991, CNP xxxxxxxxxxxxx, eliberată de către SPCEP Sector 3 la data de 28.07.2017, valabilă până la 08.02.2027, cu un aport de 252,55 euro, reprezentând 1.220 lei, împărţit în 122 părţi sociale a câte 10 lei fiecare, reprezentând 8,640227% din capitalul social al Societăţii;\n• SORIN SURU, cetăţean român, născut la data de 28.03.1964 în mun. Timişoara, jud. Timiş, domiciliat în mun. Timişoara, jud. Timiş, str. Horia Creangă nr. 17, identificat cu CI seria TM nr. 887895, CNP xxxxxxxxxxxxx, eliberată de către SPCLEP Timişoara la data de 18.03.2011, valabilă până la 28.03.2021, cu un aport de 400 lei, împărţit în 40 părţi sociale a câte 10 lei fiecare, reprezentând 2,832861% din capitalul social al Societăţii;\n• RĂZVAN RAŢ-DINCĂ, cetăţean român, născut la data de 26.05.1981 în mun. Slatina, judeţul Olt, domiciliat în oraşul Piatra-Olt, judeţul Olt, Str. Victoriei nr. 19, identificat cu CI seria OT nr. 666937, CNP xxxxxxxxxxxxx, eliberată de către SPCLEP Piatra-Olt la data de 25.04.2014, valabilă până la 26.05.2024, cu un aport de 124,19 euro, reprezentând 600 lei, împărţit în 60 părţi sociale a câte 10 lei fiecare, reprezentând 4,249292% din capitalul social al Societăţii;\n• IULIIA RAŢ-DINCĂ, cetăţean ucrainean, născută la data de 25.04.1983 în Estonia, domiciliată în oraşul Voluntari, str. Erou N. Iancu nr. 751/12, sc. C, ap. C8, judeţul Ilfov, identificată cu paşaportul tip P nr. PU 359321, emis la data de 09.04.2019 şi valabil până la 09.04.2029 de către 2 ROU şi permis de şedere\ntemporară nr. RO0491648, emis la data de 09.05.2018 şi valabil până la 08.05.2023, cu un aport de 82,80 Euro, reprezentând 400 lei, împărţit în 40 părţi sociale a 10 lei fiecare, reprezentând 2,832861% din capitalul social al Societăţii;\n• Magomed Aliev, cetăţean rus, născut la data de 08.02.1997 în Moscova, Federaţia Rusă, identificat prin paşaport tip P nr. 55 0367871, eliberat de către MИД POCCИИ 07701 la data de 31.03.2020, valabil până la data de 31.03.2030 şi carte de rezident nr. OD 061408, emisă la data de 01.10.2019, valabilă până la 17.09.2022, emisă de către Le Directeur de la Surete Publique, având reşedinţa în 7 avenue Princesse Grace, Monaco, cu un aport de 82,80 Euro, reprezentând 400 lei, împărţit în 40 părţi sociale a 10 lei fiecare, reprezentând 2,832861% din capitalul social al Societăţii;\n• Anzor Aliev, cetăţean rus, născut la data de 29.07.1968 în Urus-Martan, Federaţia Rusă, identificat prin paşaport tip P, nr. 75 6015979, eliberat de către ΦMC 77117 la data de 19.09.2017, valabil până la 19.09.2027 şi carte de rezident nr. OD 060464, emisă la data de 09.09.2019, valabilă până la data de 17.09.2022, emisă de către Le Directeur de la Surete Publique, având reşedinţa în 7 avenue Princesse Grace, Monaco, cu un aport de 82,80 Euro, reprezentând 400 lei, împărţit în 40 părţi sociale a 10 lei fiecare, reprezentând 2,832861% din capitalul social al Societăţii;\n• Shaikh Omar Saqer Mohammed Alqassimi, membru al familiei domnitoare şi cetăţean al Ras Al Khaimah, Emiratele Arabe Unite, născut la 10.12.1957 în Ras Alkhaimah, domiciliat în Emiratele Arabe Unite, Ras al Khaimah, strada Khuzam Street, Khuzam Palace, Shaikh Omar AlQassimi Office, identificat prin paşaport nr. 383C47382, emis la 23.11.2015 de către Abu Dhavi şi valabil până la 22.11.2020, cu un aport de 144,90 euro, reprezentând 700 lei, împărţit în 70 părţi sociale a 10 lei fiecare, reprezentând 4,957507% din capitalul social al Societăţii.\nBeneficiile şi pierderile\nCornel Marian Amariei\n49,575071%\nGabriel Chindriş\n21,246459%\nMihai Ivaşcu\n8,640227%\nSorin Suru\n2,832861%\nRăzvan Raţ-Dincă\n4,249292%\nIuliia Raţ-Dincă\n2,832861%\nAnzor Aliev\n2,832861%\nMagomed Aliev\n2,832861%\nShaikh Omar Saqer Mohammed\n Alqassimi\n4,957507%\n3. Se va modifica articolul 6 al Actului Constitutiv al Societăţii, care va avea următorul conţinut:\nArt. 6 Capitalul social este de 14.120 lei, din care aport în numerar 14.120 lei, divizat în 1.412 părţi sociale a 10 lei fiecare.\nStructura participării asociaţilor la capitalul social se prezintă astfel:\n• Cornel Marian Amariei, cetăţean român, născut în mun. Bucureşti, sectorul 6, la data de 09.09.1993, domiciliat în satul Floreşti (comuna Floreşti-Stoieneşti), str. Mihai Viteazul nr. 3, judeţul Giurgiu, posesor al CI seria GG, număr 482151, eliberată de SPCLEP Bolintin- Vale la data de 10.10.2018, valabilă până la 09.09.2028, CNP xxxxxxxxxxxxx, cu un aport de 7.000 lei, împărţit în 700 părţi sociale a 10 lei fiecare, reprezentând 49,575071% din capitalul social al Societăţii;\n• Gabriel Chindriş, cetăţean român, născut în mun. Bistriţa, judeţul Bistriţa-Năsăud, la data de 15.11.1973, domiciliat în judeţul Cluj, mun. Cluj-Napoca, str. Cardinal Iuliu Hossu nr. 63, ap. 21, identificat cu CI seria KX nr. 750275, eliberată de către SPCLEP Cluj-Napoca la data de 06.07.2010, valabilă până la 15.11.2020, având CNP xxxxxxxxxxxxx, cu un aport de 3.000 lei, împărţit în 300 părţi sociale a 10 lei fiecare, reprezentând 21,246459% din capitalul social al Societăţii;\n• MIHAI IVAŞCU, cetăţean român, născut la data de 08.02.1988 în jud. Teleorman, mun. Alexandria, domiciliat în mun. Bucureşti, sectorul 3, Calea Călăraşi nr. 244, bl. S21, sc. 3, et. 2, ap. 74, identificat cu CI seria RD nr. 883991, CNP xxxxxxxxxxxxx, eliberată de către SPCEP Sectorul 3 la data de 28.07.2017, valabilă până la 08.02.2027, cu un aport de 252,55 euro, reprezentând 1.220 lei, împărţit în 122 părţi sociale a 10 lei fiecare, reprezentând 8,640227% din capitalul social al Societăţii;\n• SORIN SURU, cetăţean român, născut la data de 28.03.1964 în mun. Timişoara, jud. Timiş, domiciliat în mun. Timişoara, jud. Timiş, str. Horia Creangă nr. 17, identificat cu CI seria TM nr. 887895, CNP xxxxxxxxxxxxx, eliberată de către SPCLEP Timişoara la data de 18.03.2011, valabilă până la 28.03.2021, cu un aport de 400 lei, împărţit în 40 părţi sociale a 10 lei fiecare, reprezentând 2,832861% din capitalul social al Societăţii;\n• RĂZVĂN RAŢ-DINCĂ, cetăţean rămân, născut la data de 26.05.1981 în mun. Slatina, judeţul Olt, domiciliat în oraşul Piatra-Olt, judeţul Olt, Str. Victoriei nr. 19, identificat cu CI seria OT nr. 666937, CNP xxxxxxxxxxxxx, eliberată de către SPCLEP Piatra-Olt la data de 25.04.2014, valabilă până la 26.05.2024, aport de 124,19 euro, reprezentând 600 lei, împărţit în 60 părţi sociale a 10 lei fiecare, reprezentând 4,249292% din capitalul social al Societăţii;\n• IULIIA RAŢ-DINCĂ, cetăţean ucrainean, născută la data de 25.04.1983 în Estonia, domiciliată în oraşul Voluntari, str. Erou N. Iancu nr. 751/12, sc. C, ap. C8, judeţul Ilfov, identificată cu paşaportul tip P nr. PU 359321, emis la data de 09.04.2019 şi valabil până la 09.04.2029 de către 2 ROU şi permis de şedere temporară nr. RO0491648 emis la data de 09.05.2018 şi valabil până la 08.05.2023, cu un aport de 82,80 euro, reprezentând 400 lei, împărţit în 40 părţi sociale a 10 lei fiecare, reprezentând 2,832861% din capitalul social al Societăţii;\n• MAGOMED ALIEV, cetăţean rus, născut la data de 08.02.1997 în Moscova, Federaţia Rusă, identificat prin paşaportul tip P nr. 55 0367871, eliberat de către MИД POCCИИ 07701 la data de 31.03.2020, valabil până la data de 31.03.2030 şi carte de rezident nr. OD 061408 emisă la data de 01.10.2019, valabilă până la 17.09.2022, emisă de către Le Directeur de la Surete Publique, având reşedinţa în 7 avenue Princesse Grace, Monaco, cu un aport de 82,80 euro, reprezentând 400 lei, împărţit în 40 părţi sociale a 10 lei fiecare, reprezentând 2,832861% din capitalul social al Societăţii;\n• ANZOR ALIEV, cetăţean rus, născut la data de 29.07.1968 în Urus-Martan, Federaţia Rusă, identificat prin paşaportul tip P nr. 75 6015979 eliberat de către ФMC 77117 la data de 19.09.2017, valabil până la 19.09.2027 şi carte de rezident nr. OD 060464 emisă la data de 09.09.2019 valabilă până la data de 17.09.2022 emisă de către Le Directeur de la Surete Publique, având reşedinţa în 7 avenue Princesse Grace, Monaco, cu un aport de 82,80 euro, reprezentând 400 lei, împărţit în 40 părţi sociale a 10 lei fiecare, reprezentând 2,832861% din capitalul social al Societăţii;\n• SHAIKH OMAR SAQER MOHAMMED ALQASSIMI, membru al familiei domnitoare şi cetăţean al Ras Al Khaimah, Emiratele Arabe Unite, născut la 10.12.1957 în Ras Alkhaimah domiciliat în Emiratele Arabe Unite, Ras Al Khaimah, strada Khuzam Street, Khuzam Palace, Shaikh Omar AlQassimi Office, identificat prin paşaportul nr. 383C47382 emis la 23.11.2015 de către Abu Dhabi şi valabil până la 22.11.2020, cu un aport de 144,90 euro, reprezentând 700 lei, împărţit în 70 părţi sociale a 10 lei fiecare, reprezentând 4,957507% din capitalul social al Societăţii.\nBeneficiile şi pierderile\nCornel Marian Amariei\n49,575071%\nGabriel Chindriş\n21,246459%\nMihai Ivaşcu\n8,640227%\nSorin Suru\n2,832861%\nRăzvan Raţ-Dincă\n4,249292%\nIulia Raţ-Dincă\n2,832861%\nAnzor Aliev\n2,832861%\nMagomed Aliev\n2,832861%\nShaikh Omar Saqer Mohammed\n4,957507%\nAlqassimi\nAportul la capitalul social precum şi bunurile sau valorile dobândite de Societate pe tot parcursul existenţei acesteia constituie proprietatea Societăţii.\nAdunarea generală a asociaţilor va hotărî, dacă este cazul, asupra emiterii unor certificate doveditoare ale părţilor sociale, precum şi asupra condiţiilor eliberării eventualelor duplicate în caz de dispariţie, pierdere sau distrugere a acestora.\"\n4. Majorarea capitalului social al \"Societăţii\", prin aportul în numerar al Viitorilor Asociaţi, cu suma totală de 72,45 Euro, reprezentând 350 lei, calculat la cursul comunicat de Banca Naţională a României, valabil în ziua de 13.04.2020, rotunjit (4,83092 lei pentru 1 Euro), prin emiterea a 35 părţi sociale, având o valoare nominală de 10 lei fiecare.\n5. Prima de emisiune aferentă majorării de capital menţionată la punctul 4 de mai sus, reprezintă suma de 249.927,55 Euro, reprezentând 1.207.379,99 lei, calculat la cursul comunicat de Banca Naţională a României, valabil în ziua de 13.04.2020, rotunjit (4,83092 lei pentru 1 Euro), se înregistrează în contul 1041 al Societăţii, că urmare a prezentei majorări de capital social, fără ca această primă de emisiune să fie încorporată în capitalul social al Societăţii.\nAportul în numerar, conform punctelor 4 şi 5 de mai sus se divide între Viitorii Asociaţi, după cum urmează:\na) pentru un aport în numerar în valoare de 28,98 euro, echivalentul a 140 lei, Societatea emite 14 părţi sociale, având o valoare nominală de 10 lei fiecare şi o valoare totală de 140 lei, Viitorului Asociat, Edgar Johan Louis Christiaan Reijtenbagh.\nPrima de emisiune în legătură cu majorarea de capital social de la acest punct a) reprezintă suma de 99.971,02 Euro, reprezentând echivalentul a 482.951,99 lei, la cursul de 1 Euro = 4,83092 lei;\nb) pentru un aport în numerar în valoare de 28,98 euro, echivalentul a 140 lei, Societatea emite 14 părţi sociale, având o valoare nominală de 10 lei fiecare şi o valoare totală de 140 lei, Viitorului Asociat, ASCENDIS CONSULTING - S.R.L.\nPrima de emisiune în legătură cu majorarea de capital social de la acest punct b) reprezintă suma de 99.971,02 Euro, reprezentând echivalentul a 482.951,99 lei, la cursul de 1 Euro = 4,83092 lei, şi\nc) pentru un aport în numerar în valoare de 14,49 euro, echivalentul a 70 lei, Societatea emite 7 părţi sociale, având o valoare nominală de 10 lei fiecare şi o valoare totală de 70 lei, Viitorului Asociat, ULPIA VENTURES - S.R.L.\nPrima de emisiune în legătură cu majorarea de capital social de la acest punct c) reprezintă suma de 49.985,51 Euro, reprezentând echivalentul a 241.475,995 lei, la cursul de 1 Euro = 4,83092 lei;\nCa urmare a cumulării valorilor prezentelor majorări de la punctul 4 de mai sus, capitalul social total subscris şi vărsat al Societăţii va fi de 14.470 lei, aport în numerar, împărţit în 1.447 părţi sociale, cu o valoare nominală de 10 lei fiecare, structura capitalului social al Societăţii fiind următoarea:\n1. CORNEL MARIAN AMARIEI, cetăţean român, născut în mun. Bucureşti, sectorul 6, la data de 09.09.1993, domiciliat în satul Floreşti, (comuna Floreşti- Stoieneşti), str. Mihai Viteazul nr. 3, judeţul Giurgiu, posesor al CI seria GG număr 482151 eliberată de SPCLEP Bolintin Vale la data de 10.10.2018, valabilă până la 09.09.2028, CNP xxxxxxxxxxxxx, cu un aport de 7.000 lei, împărţit în 700 părţi sociale a câte 10 lei fiecare, reprezentând 48,37595% din capitalul social al Societăţii;\n2. GABRIEL CHINDRIŞ, cetăţean român, născut în mun. Bistriţa, judeţul Bistriţa-Năsăud, la data de 15.11.1973, domiciliat în judeţul Cluj satul Feleacu, (com. Feleacu) nr. 181A, identificat cu CI seria CJ nr. 519100 eliberată de către SPCLEP Cluj la data de 19.11.2020, valabilă până la 15, 11.2030, având CNP xxxxxxxxxxxxx, cu un aport de 3000 lei, împărţit în 300 părţi, sociale a câte 10 lei fiecare, reprezentând 20,73255% din capitalul social al Societăţii;\n3. MIHAI IVAŞCU, cetăţean român, născut la data de 08.02.1988 în jud. Teleorman, Mun. Alexandria, domiciliat în mun. Bucureşti, sectorul 3, Calea Călăraşi nr. 244, bl. S21, sc. 3, et. 2, ap. 74, identificat cu CI seria RD nr. 883991, CNP xxxxxxxxxxxxx, eliberată de către SPCEP sectorul 3 la data de 28.07.2017, valabilă până la 08.02.2027, cu un aport de 252,55 euro, reprezentând 1.220 lei, împărţit în 122 părţi sociale a câte 10 lei fiecare, reprezentând 8,431237% din Capitalul social al Societăţii;\n4. SORIN SURU, cetăţean român, născut la data de 28.03.1964 în mun. Timişoara, jud. Timiş, domiciliat în mun. Timişoara, jud. Timiş, str. Horia Creangă nr. 17, identificat cu CI seria TM nr. 887895, CNP xxxxxxxxxxxxx, eliberată de către SPCLEP Timişoara la data de 18.03.2011, valabilă până la 28.03.2021, cu un aport de 400 lei, împărţit în 40 părţi sociale a câte 10 lei fiecare, reprezentând 2,764340% din capitalul social al Societăţii;\n5. RĂZVAN RAŢ-DINCĂ, cetăţean român, născut la data de 26.05.1981 în mun. Slatina, judeţul Olt, domiciliat în oraşul Piatra-Olt, judeţul Olt, Str. Victoriei ni. 19, identificat cu CI seria OT nr. 666937, CNP xxxxxxxxxxxxx, eliberată de către SPCLEP Piatra-Olt la data de 25.04.2014, valabilă până la 26.05.2024, cu un aport de 124,19 euro, reprezentând 600 lei, împărţit în 60 părţi sociale a câte 10 lei fiecare, reprezentând 4,146510% din capitalul social al Societăţii;\n6. IULIIA RAŢ-DINCA, cetăţean ucrainean, născută la data de 25.04.1983 în Estonia, domiciliată în oraşul Voluntari, str. Erou N. Iancu nr. 751/12, sc. C, ap. C8, judeţul Ilfov, identificată cu paşaportul tip P nr. PU 359321 emis la data de 09.04.2019 şi valabil până la 09.04.2029 de către 2 ROU şi permis de şedere temporară nr. RO0491648 emis la data de 09.05.2018 şi valabil până la 08.05.2023, cu un aport de 82,80 euro, reprezentând 400 lei, împărţit în 40 părţi sociale a câte 10 lei fiecare, reprezentând 2,764340% din capitalul social al Societăţii;\n7. MAGOMED ALIEV, cetăţean rus, născut la data de 08.02.1997 în Moscova, Federaţia Rusă, identificat prin paşaportul tip P nr. 55 0367871 eliberat de către MИД POCCИИ 07701 la data de 31.03.2020, valabil până la data de 31.03.2030 şi carte de rezident nr. OD 061408, emisă la data de 01.10.2019, valabilă până la 17.09.2022, emisă de către Le Directeur de la Surele Publique, având reşedinţa în 7 avenue Princesse Grace, Monaco, cu un aport de 82,80 euro, reprezentând 400 lei, împărţit în 40 părţi sociale a 10 lei fiecare, reprezentând 2,764340% din capitalul social al Societăţii;\n8. Anzor Aliev, cetăţean rus, născut la data de 29.07.1968 în Urus-Martan, Federaţia Rusă, identificat prin paşaport tip P nr. 75 6015979, eliberat de către ΦMC\n77117 la data de 19.09.2017, valabil până la 19.09.2027 şi carte de rezident nr. OD 060464, emisă la data de 09.09.2019, valabilă până la data de 17.09.2022, emisă de către Le Directeur de la Surete Publique, având reşedinţa în 7 avenue Princesse Grace, Monaco, cu un aport de 82,80 Euro, reprezentând 400 lei, împărţit în 40 părţi sociale a 10 lei fiecare, reprezentând 2,764340% din capitalul social al Societăţii;\n9. Shaikh Omar Saqer Mohammed Alqassimi, membru al familiei domnitoare şi cetăţean al Ras Al Khaimah, Emiratele Arabe Unite, născut la 10.12.1957 în Ras Alkhaimah, domiciliat în Emiratele Arabe Unite, Ras Al Khaimah, strada Khuzam Street, Khuzam Palace, Shaikh Omar AlQassimi Office, identificat prin paşaport nr. 383C47382, emis la 23.11.2015 de către Abu Dhabi şi valabil până la 22.11.2020, cu un aport de 144,90 Euro, reprezentând 700 lei, împărţit în 70 părţi sociale a 10 lei fiecare, reprezentând 4,837595% din capitalul social al Societăţii;\n10. Edgar Johan Louis Christiaan Reijtenbagh, cetăţean olandez, născut la data de 21.09.1977, având domiciliul în Monaco, Villa Mascotte, Rue des Giroflees nr. 3, 9800 Monaco, identificat cu paşaport nr. BVDR451P1, eliberat de către Burg van Gameente Haarlemmermeer, în data de 21.04.2014, valabil până la 21.04.2024, cu un aport de 28,98 Euro, reprezentând 140 lei, împărţit în 14 părţi sociale a 10 lei fiecare, reprezentând 0,967519% din capitalul social al Societăţii;\n11. ASCENDIS CONSULTING - S.R.L., o societate cu răspundere limitată, funcţionând în conformitate cu legile din România, cu sediul în Bucureşti, sectorul 1, str. Ion Ionescu de la Brad nr. 2B, la parterul Complexului de Birouri Gabrielle Center\", tronson I, camera 2, reprezentată de către Gosu Andrei Eugen, în calitate de administrator, având număr de înregistrare la Oficiul Registrului Comerţului de pe lângă Tribunalul Bucureşti J40/3140/1997 şi CUI 9398288, cu un aport de 28,98 Euro, reprezentând 140 lei, împărţit în 14 părţi sociale a 10 lei fiecare, reprezentând 0,967519% din capitalul social al Societăţii;\n12. ULPIA VENTURES - S.R.L., o societate cu răspundere limitată, funcţionând în conformitate cu legile din România, cu sediul în Bucureşti, sectorul 1, Piaţa Montreal nr. 10, în Incinta Clădirii World Trade Center Bucureşti, Intrarea D, camera nr. 1.10, etaj 1, reprezentată de către Marinescu Cătălin-Valentin, în calitate de administrator, având număr de înregistrare la Oficiul Registrului Comerţului de pe lângă Tribunalul Bucureşti J40/15139/2016 şi CUI 36749688, cu un aport de 14,49 Euro, reprezentând 70 lei, împărţit în 7 părţi sociale a 10 lei. fiecare, reprezentând 0,483760% din capitalul social al Societăţii.\nBeneficiile şi pierderile\nCornel Marian Amariei\n48,37595%\nGabriel Chindriş\n20,73255%\nMihai Ivaşcu\n8,431237%\nSorin Suru\n2,764340%\nRăzvan Raţ-Dincă\n4,146510%\nIuliia Raţ-Dincă\n2,764340%\nAnzor Aliev\n2,764340%\nMagomed Aliev\n2,764340%\nShaikh Omar Saqer Mohammed\n4,837595%\nAlqassimi\nEDGAR JOHAN LOUIS\n0,967519%\nCHRISTIAAN REIJTENBAGH\nASCENDIS CONSULTING - S.R.L.\n0,967519%\nULPIA VENTURES - S.R.L.\n0,483760%\n6. Se va modifica articolul 6 al Actului Constitutiv al Societăţii, care va avea următorul conţinut:\nArt. 6. Capitalul social este de 14,470 lei, din care aport în numerar 14.470 lei, divizat în 1.447 părţi sociale a 10 lei fiecare.\nStructura participării asociaţilor la capitalul social se prezintă astfel:\n1. CORNEL MARIAN AMARIEI, cetăţean român, născut în mun. Bucureşti, sectorul 6, la data de 09.09.1993, domiciliat în satul Floreşti (comuna Floreşti- Stoieneşti), str. Mihai Viteazul nr. 3, judeţul Giurgiu, posesor al CI seria GG număr 482151 eliberată de SPCLEP Bolintin-Vale la data de 10.10.2018, valabilă până la 09.09.2028, CNP xxxxxxxxxxxxx, cu un aport de 7.000 lei, împărţit în 700 părţi sociale a 10 lei fiecare, reprezentând 48,37595% din capitalul social al Societăţii;\n2. GABRIEL CHINDRIŞ, cetăţean român, născut în mun. Bistriţa, judeţul Bistriţa-Năsăud, la data de 15.11.1973, domiciliat în judeţul Cluj, satul Feleacu (com. Feleacu), nr. 181A, identificat cu CI seria CJ nr. 519100 eliberată de către SPCLEP Cluj la data de 19.11.2020, valabilă până la 15.11.2030, având CNP xxxxxxxxxxxxx, cu un aport de 3.000 lei, împărţit în 300 părţi sociale a 10 lei fiecare, reprezentând 20,73255% din capitalul social al Societăţii;\n3. MIHAI IVAŞCU, cetăţean român, născut la data de 08.02.1988 în jud. Teleorman, mun. Alexandria, domiciliat în mun. Bucureşti, sectorul 3, Calea Călăraşi nr. 244, bl. S21, sc. 3, et. 2, ap. 74, identificat cu CI seria RD nr. 883991, CNP xxxxxxxxxxxxx, eliberată de către SPCEP Sectorul 3 la data de 28.07.2017, valabilă până la 08.02.2027, cu un aport de 252,55 euro, reprezentând 1.220 lei, împărţit în 122 părţi sociale a 10 lei fiecare, reprezentând 8,431237% din capitalul social al Societăţii;\n4. SORIN SURU, cetăţean român, născut la data de 28.03.1964 în mun. Timişoara, jud. Timiş, domiciliat în mun. Timişoara, jud. Timiş, str. Horia Creangă nr. 17, identificat cu CI seria TM nr. 887895, CNP xxxxxxxxxxxxx, eliberată de către SPCLEP Timişoara la data de 18.03.2011, valabilă până la 28.03.2021, cu un aport de 400 lei, împărţit în 40 părţi sociale a 10 lei fiecare, reprezentând 2,764340% din capitalul social al Societăţii;\n5. RĂZVAN RAŢ-DINCĂ, cetăţean român, născut la data de 26.05.1981 în mun. Slatina, judeţul Olt, domiciliat în oraşul Piatra-Olt, judeţul Olt, Str. Victoriei nr. 19, identificat cu CI seria OT nr. 666937, CNP xxxxxxxxxxxxx, eliberată de către SPCLEP Piatra-Olt la data de 25.04.2014, valabilă până la 26.05.2024, cu un aport de 124,19 euro, reprezentând 600 lei, împărţit în 60 părţi sociale a 10 lei fiecare, reprezentând 4,146510% din capitalul social al Societăţii;\n6. IULIIA RAŢ-DINCĂ, cetăţean ucrainean, născută la data de 25.04.1983 în Estonia, domiciliată în oraşul Voluntari, str. Erou N. Iancu nr. 751/12, sc. C, ap. C8, judeţul Ilfov, identificată cu paşaportul tip P nr. PU 359321 emis la data de 09.04.2019 şi valabil până la 09.04.2029 de către 2 ROU şi permis de şedere temporară nr. RO0491648 emis la data de 09.05.2018 şi valabil până la 08.05.2023, cu un aport de 82,80 euro, reprezentând 400 lei, împărţit în 40 părţi sociale a 10 lei fiecare, reprezentând 2,764340% din capitalul social al Societăţii;\n7. MAGOMED ALIEV, cetăţean rus, născut la data de 08.02.1997 în Moscova, Federaţia Rusă, identificat prin paşaportul tip P nr. 55 0367871 eliberat de către MИД POCCИИ 07701 la data de 31.03.2020, valabil până la data de 31.03.2030 şi carte de rezident nr. OD 061408 emisă la data de 01.10.2019, valabilă până la 17.09.2022, emisă de către Le Directeur de la Surete Publique, având reşedinţa în 7 avenue Princesse Grace, Monaco, cu un aport de 82,80 Euro, reprezentând 400 lei, împărţit în 40 părţi sociale a 10 lei fiecare, reprezentând 2,764340% din capitalul social al Societăţii;\n8. Anzor Aliev, cetăţean rus, născut la data de 29.07.1968 în Urus-Martan, Federaţia Rusă, identificat prin paşaport tip P nr. 75 6015979, eliberat de către ФMC\n77117 la data de 19.09.2017, valabil până la 19.09.2027 şi carte de rezident nr. OD 060464, emisă la data de 09.09.2019, valabilă până la dată de 17.09.2022, emisă de către Le Directeur de la Surete Publique, având reşedinţa în 7 avenue Princesse Grace, Monaco, cu un aport de 82,80 Euro, reprezentând 400 lei, împărţit în 40 părţi sociale a 10 lei fiecare, reprezentând 2,764340% din capitalul social al Societăţii;\n9. Shaikh Omar Saqer Mohammed Alqassimi, membru al familiei domnitoare şi cetăţean al Ras Al Khaimah, Emiratele Arabe Unite, născut la 10.12.1957 în Ras Alkhaimah, domiciliat în Emiratele Arabe Unite, Ras Al Khaimah, strada Khuzam Street, Khuzam Palace, Shaikh Omar AlQassimi Office, identificat prin paşaport nr. 383C47382, emis la 23.11.2015 de către Abu Dhabi şi valabil până la 22.11.2020, cu un aport de 144,90 Euro, reprezentând 700 lei, împărţit în 70 părţi sociale a 10 lei fiecare, reprezentând 4,837595% din capitalul social al Societăţii;\n10. Edgar Johan Louis Christiaan Reijtenbagh, cetăţean olandez, născut la data de 21.09.1977, având domiciliul în Monaco, Villa Mascotte, Rue des Giroflees nr. 3, 9800 Monaco, identificat cu paşaport nr. BVDR451P1, eliberat de către Burg van Gameente Haarlemmermeer, în data de 21.04.2014, valabil până la 21.04.2024, cu un aport de 28,98 Euro, reprezentând 140 lei, împărţit în 14 părţi sociale a 10 lei fiecare, reprezentând 0,967519% din capitalul social al Societăţii;\n11. ASCENDIS CONSULTING - S.R.L., societate cu răspundere limitată, funcţionând în conformitate cu legile din România, cu sediul în Bucureşti, sector 1, Str. Ion Ionescu de la Brad nr. 2B, la parterul Complexului de Birouri Gabrielle Center\", tronson I, camera 2, reprezentată de către Gosu Andrei Eugen, în calitate de administrator, având număr de înregistrare la Oficiul Registrului Comerţului de pe lângă Tribunalul Bucureşti J40/3140/1997 şi CUI 9398288, cu un aport de 28,98 Euro, reprezentând 140 lei, împărţit în 14 părţi sociale a 10 lei fiecare, reprezentând 0,967519% din capitalul social al Societăţii;\n12. ULPIA VENTURES - S.R.L., o societate cu răspundere limitată, funcţionând în conformitate cu legile din România, cu sediul în Bucureşti, sectorul 1, Piaţa Montreal nr. 10, în Incinta Clădirii World Trade Center Bucureşti, Intrarea D, camera nr. 1.10, etaj 1, reprezentată de către Marinescu Cătălin-Valentin, în calitate de administrator, având număr de înregistrare la Oficiul Registrului Comerţului de pe lângă Tribunalul Bucureşti J40/15139/2016 şi CUI 36749688, cu un aport de 14,49 Euro, reprezentând 70 lei, împărţit în 7 părţi sociale, a 10 lei fiecare, reprezentând 0,483760% din capitalul social al Societăţii.\nBeneficiile şi pierderile\nCornel Marian Amariei\n48,37595%\nGabriel Chindriş\n20,73255%\nMihai Ivaşcu\n8,431237%\nSorin Suru\n2,764340%\nRăzvan Raţ-Dincă\n4,146510%\nIuliia Raţ-Dincă\n2,764340%\nAnzor Aliev\n2,764340%\nMAGOMED ALIEV\n2,764340%\nSHAIKH OMAR SAQER\n4,837595%\nMOHAMMED ALQASSIMI\nEDGAR JOHAN LOUIS\n0,967519%\nCHRISTIAAN REIJTENBAGH\nASCENDIS CONSULTING - S.R.L.\n0,967519%\nULPIA VENTURES - S.R.L.\n0,483760%\nAportul la capitalul social precum şi bunurile sau valorile dobândite de Societate pe tot parcursul existenţei acesteia constituie proprietatea Societăţii.\nAdunarea generală a asociaţilor va hotărî, dacă este cazul, asupra emiterii unor certificate doveditoare ale părţilor sociale, precum şi asupra condiţiilor eliberării eventualelor duplicate în caz de dispariţie, pierdere sau distrugere a acestora.\"\n7. Se va modifica articolul 9 al Actului Constitutiv al Societăţii, care va avea următorul conţinut:\nArt. 9 Obligaţiile sociale sunt garantate cu patrimoniul social, iar asociaţii vor răspunde numai în limita cotei de participare la capitalul social.\nPatrimoniul societăţii nu poate fi grevat de datorii, sarcini sau alte obligaţii personale ale asociaţilor.\nSocietatea şi asociaţii nu utilizează prima de emisiune la majorarea capitalului social şi nu o repartizează către asociaţi, pe o durată de 3 ani de la data înregistrării investitorilor individuali - business angel la registrul comerţului.\nHotărârile privind planul de afaceri şi renunţarea la împărţirea profitului, aferente investiţiei efectuate, se vor lua cu acordul unanim al asociaţilor.\nHotărârile privind reducerea şi/sau majorarea capitalului social se vor lua cu voturile asociaţilor reprezentând 80% din capitalul social al Societăţii.\nDacă prin majorarea capitalului social al Societăţii se creează o diluare a cotei de participare a vreunuia dintre asociaţi cu mai mult de 20%, în acest caz, hotărârile privind majorarea capitalului social se vor lua cu voturile asociaţilor reprezentând 95% din capitalul social al Societăţii.\nAtunci când majorarea capitalului social se realizează în scopul cooptării unor asociaţi, care deţin calitatea de salariaţi/angajaţi sau colaboratori ai Societăţii, cărora li se acordă părţi sociale la valoarea nominală, acordarea acestora se va realiza cu votul asociaţilor reprezentând 75% din capitalul social al Societăţii. Se precizează în mod expres faptul că numărul de părţi sociale care pot fi acordate către persoanele şi în condiţiile sus-menţionate nu va putea depăşi o cotă maximă de 4% din capitalul Social al Societăţii pentru fiecare an calendaristic, dar pentru o perioadă maximă ce nu poate depăşi 3 (trei) ani (2020 - 2021 - 2022). Numărul de opţiuni neacordate până la finalul unui an calendaristic poate fi prorogat în următorul/următorii an(i), în condiţiile în care nu este acordat în mod complet într-un an calendaristic, dar nu mai târziu de expirarea a 3 (trei) ani calendaristici, adică nu mai târziu de 31 decembrie 2022, rezultând astfel un număr maxim de părţi sociale care nu va putea depăşi, pentru întreaga perioadă, o cotă maximă totală de 12% din capitalul social al Societăţii.\nMajorarea capitalului social prin emiterea de noi părţi sociale\nÎn orice moment după data prezentului, dacă Societatea va emite sau va propune să organizeze o majorare de capital social, prin emiterea de părţi sociale noi, dar totuşi excluzând orice opţiuni şi părţi sociale corespunzătoare emise şi acordate în condiţiile şi în limitele prevăzute la art. 9. alineat 7 din prezentul Act Constitutiv salariaţilor/angajaţilor sau colaboratorilor din Compania în conformitate cu orice planuri de opţiuni de părţi sociale pentru angajaţi, acum sau în vigoare în continuare) (în continuare \"Părţi sociale suplimentare\"), orice asociat va avea dreptul de a subscrie şi de a cumpăra la acelaşi preţ pe parte socială acel număr de părţi sociale suplimentare necesare să le asigure că respectivul Asociat îşi menţine aceeaşi cotă de participare la capitalul social al Societăţii pe care o avea respectivul Asociat, înainte de majorarea capitalului social cu Părţi sociale suplimentare.\nOrice ofertă de a emite Părţi sociale suplimentare se va face printr-o notificare scrisă (\"Notificarea de subscriere\") cu cel puţin 15 (cincisprezece) zile înainte de data convocării Adunării Generale a Asociaţilor având pe ordinea de zi aprobarea emiterii Părţilor sociale suplimentare. Notificarea de subscriere va prevedea (i) numărul de Părţi sociale suplimentare, propuse pentru a fi emise oricărei persoane, (ii) tipul de majorare de capital social (cu sau fără prima de emisiune) (iii) contraprestaţia (sau modalitatea de determinare a contraprestaţiei pentru emiterea părţilor sociale suplimentare), dacă există, pentru care astfel de Părţi sociale suplimentare se emit şi termenii de plată şi (iv) data propusă pentru emiterea acestor Părţi sociale suplimentare.\nNu mai târziu de 10 (zece) zile de la primirea Notificării de subscriere, Asociaţii care doresc să îşi conserve cota de participare la capitalul social al Societăţii pot transmite Societăţii o notificare în scris în care informează dacă aleg să subscrie numărul respectiv de părţi sociale (\"Părţi sociale compensatorii\"), necesare pentru a evita diluarea participaţiei lor prin emiterea Părţilor sociale suplimentare, în conformitate cu Notificarea de subscriere şi păstrarea cotei de participare avută de Asociat înainte de emiterea Părţilor sociale suplimentare.\nUn eşec al Asociatului respectiv de a răspunde în scris în termen de 10 zile şi de a se angaja la subscrierea Părţilor sociale compensatorii în termenii de plată identici cu aceia aplicabili în cazul emiterii Părţilor sociale compensatorii, va fi considerat o renunţare şi un vot negativ privind subscrierea Părţilor sociale suplimentare de către respectivul Asociat.\nDacă, cu toate acestea, Asociaţii respectivi optează în favoarea emiterii Părţilor sociale compensatorii, Părţile sociale compensatorii pe care au ales să le cumpere astfel încât să îţi menţină cota de participare vor fi emise şi subscrise de către acelaşi Asociat, în acelaşi timp şi în aceleaşi termeni şi condiţii ca şi Părţile sociale suplimentare emise şi subscrise de terţi.\nPentru evitarea oricărui dubiu, dacă, din orice motiv, emiterea Părţilor sociale suplimentare va eşua, dreptul Asociatului cu privire la emiterea Părţilor sociale compensatorii va expira.\n8. Se va modifica articolul 11 al Actului Constitutiv al Societăţii, care va avea următorul conţinut:\n\"Art. 11. Prin hotărârea adunării generale a asociaţilor se decide asupra tuturor activităţilor desfăşurate de Societate pentru realizarea obiectului de activitate, scop în care:\na) Aprobă bilanţul şi stabileşte repartizarea beneficiului net;\nb) Desemnează şi revocă administratori şi cenzori, le stabileşte împuternicire şi remuneraţia, dându-le descărcare pentru activitatea lor;\nc) Hotărăşte modificarea actului constitutiv.\nAsociaţii pot transmite votul în cadrul adunărilor generale ale asociaţilor şi prin corespondenţă.\"\n9. Împuternicirea S.C.P. Măgureanu, Bourdenet şi Asociaţii S.C.A., cu sediul în Bucureşti, str. George Călinescu nr. 5, etaj 1, ap. 2, sectorul 1, cod 011691 precum şi a oricăror avocaţi care activează în cadrul acesteia, în special dar nelimitat la următorul:\n- MARIUS VLAD MĂGUREANU, posesor al Cl seria RR nr. 920685 emisă la 18.04.2012 de către SPCEP Sectorul 5,\nîn vederea semnării în numele subscrisei societăţi şi a Asociaţilor, a oricăror şi tuturor documentelor necesare înregistrării menţiunii privind cesiunea părţilor sociale între asociaţi (inclusiv actul constitutiv actualizat al Societăţii, formulare, declaraţii, etc.), precum şi în vederea reprezentării şi îndeplinirii tuturor formalităţilor necesare în faţa autorităţilor competente (inclusiv dar fără limitare: Notar public, Registrul Comerţului, autorităţi fiscale, etc.), precum şi să delege atribuţii conferite prin prezenta decizie în mod individual în tot sau în parte către o persoană de încredere.\nPrezenta hotărâre a fost luată astăzi, 01.03.2021, în 12 (douăsprezece) exemplare originale.\n(58/6.514.789)",
  "bulletin_id": null,
  "article_id": null,
  "list_parent_classes": null,
  "collapse_id": null,
  "source_href": null
}