{
  "type": null,
  "number": "1853",
  "date": "10.05.2021",
  "year": "2021",
  "company_name": "Societatea GESCONT - S.R.L.",
  "meta": {
    "cui": "14245981",
    "legal_type": "SRL",
    "reg_number": "J26/747/2001",
    "euid": null,
    "caen": [],
    "capital": null,
    "address": "în mun. Târnăveni, judeţul Mureş"
  },
  "raw_text": "Societatea GESCONT - S.R.L.\nHOTĂRÂREA NR. 1/26.02.2021\na asociatului unic\nSubsemnata, KISS JUDITH, cetăţean român, născută la data de 19.03.1961, în mun. Târnăveni, judeţul Mureş, domiciliată în mun. Târgu Mureş, Bulevardul 1848 nr. 50, ap. 13, judeţul Mureş, identificată cu C.I. seria ZS nr. 031997, eliberată de SPCLEP Tg. Mureş la data de 28.03.2018, având CNP xxxxxxxxxxxxx, în calitate de asociat unic al GESCONT - S.R.L., cu sediul în mun. Târgu Mureş, str. Lămâiţei nr. 19, ap. 11, judeţul Mureş, înregistrată la ORC Mureş sub J26/747/2001, având CUI 14245981, azi, 26.02.2021, am luat următoarele hotărâri:\nArt. 1. Se schimbă sediul social. Noul sediu va fi în mun. Târgu Mureş, Bulevardul 1848 nr. 52, ap. 17, judeţul Mureş.\nArt. 2. Se radiază sediul secundar din mun. Târgu Mureş, Bulevardul 1848 nr. 63, ap. 4, judeţul Mureş.\nArt. 3. Se redefineşte durata mandatului administratorului KISS JUDITH. Noua durată va fi pe termen de 50 de ani, începând cu data de 26.02.2021, dacă nu intervine revocarea sau demisia sa din funcţie.\nÎntocmit în trei exemplare sub semnătură privată azi, 26.02.2021.\n(8/6.476.079)",
  "bulletin_id": null,
  "article_id": null,
  "list_parent_classes": null,
  "collapse_id": null,
  "source_href": null
}