{
  "type": null,
  "number": "1853",
  "date": "10.05.2021",
  "year": "2021",
  "company_name": "Societatea ARTSCULPT - S.R.L.",
  "meta": {
    "cui": "41046838",
    "legal_type": "SRL",
    "reg_number": "J49/611/2019",
    "euid": null,
    "caen": [
      "1629"
    ],
    "capital": null,
    "address": "Focşani, str. Mărăşeşti nr. 72"
  },
  "raw_text": "Societatea ARTSCULPT - S.R.L.\nDECIZIA NR. 4/15.04.2021\na asociatului unic al S.C. ARTSCULPT - S.R.L.\nSubsemnatul, Căluian Valentin Relu, născut la data de 25.07.1973 în municipiul Focşani, domiciliat în Goleşti, str. Oituz nr. 26B, posesor al CI seria VN nr. 697658, eliberată de SPCLEP Focşani la data de 12.06.2018,\navând CNP xxxxxxxxxxxxx, în calitate de asociat unic al ARTSCULPT - S.R.L., cu sediul social în Focşani, str. Mărăşeşti nr. 72, înregistrată la Registrul Comerţului sub nr. J49/611/2019, având CUI 41046838, am decis:\nArt. 1 Modificarea mandatului administratorului, aşa cum este stabilită la articolul 5.4 din Statut, din \"nelimitat\" în \"pentru o perioadă de 50 (cincizeci) de ani, cu puteri depline de reprezentare şi administrare\", conform dispoziţiilor legale.\nArt. 2 Adăugarea următoarelor coduri CAEN:\n- 1629 Fabricarea altor produse din lemn; fabricarea articolelor din plută, paie şi din alte materiale vegetale împletite;\n- 1610 Tăierea şi rindeluirea lemnului;\n- 1623 Fabricarea altor elemente de dulgherie şi tâmplărie, pentru construcţii;\n- 1624 Fabricarea ambalajelor din lemn;\n- 3101 Fabricarea de mobilă pentru birouri şi magazine;\n- 4759 Comerţ cu amănuntul al mobilei, al articolelor de iluminat şi al articolelor de uz casnic n.c.a., în magazine specializate.\n(42/6.517.463)",
  "bulletin_id": null,
  "article_id": null,
  "list_parent_classes": null,
  "collapse_id": null,
  "source_href": null
}