{
  "type": null,
  "number": "1853",
  "date": "10.05.2021",
  "year": "2021",
  "company_name": "Societatea TRUE FIRE - S.R.L.",
  "meta": {
    "cui": "43924129",
    "legal_type": "SRL",
    "reg_number": "J40/4740/2021",
    "euid": "ROONRC.J40",
    "caen": [
      "8559"
    ],
    "capital": "200 lei, integral vărsat, total părţi sociale: 20 a câte 10 lei fiecare, cota de participare la beneficii: 100%, cota de participare la pierderi: 100%",
    "address": null
  },
  "raw_text": "Societatea TRUE FIRE - S.R.L.\nROMÂNIA\nMINISTERUL JUSTIŢIEI\nOFICIUL NAŢIONAL AL REGISTRULUI COMERŢULUI\nOFICIUL REGISTRULUI COMERŢULUI DE PE LÂNGĂ TRIBUNALUL BUCUREŞTI\nEXTRAS AL REZOLUŢIEI NR. 36661/16.03.2021\nDaniela Lupu - Persoana desemnată conform art. 11 alin. (1) din O.U.G nr. 116/2009 pentru instituirea unor măsuri privind activitatea de înregistrare în registrul comerţului, aprobată cu modificări şi completări prin Legea nr. 84/2010, cu modificările şi completările ulterioare\nÎn baza cererii nr. 98503 din data de 15.03.2021 şi a actelor doveditoare depuse, persoana desemnată la Oficiul Registrului Comerţului de pe lângă Tribunalul Bucureşti a dispus autorizarea constituirii, înmatricularea şi înregistrarea societăţii:\n- denumire şi formă juridică: TRUE FIRE - S.R.L.\n- cod unic de înregistrare: 43924129\n- identificator unic la nivel european (EUID): ROONRC.J40/4740/2021\n- număr de ordine în registrul comerţului: J40/4740/2021\n- sediul social: Bucureşti, sectorul 6, strada Vasile Golcea nr. 18-20, bloc 1, scara 1, etaj 2, ap. 19\n- domeniul principal de activitate: grupa CAEN:\n855 - Alte forme de învăţământ\n- activitate principală:\n8559 - Alte forme de învăţământ n.c.a.\n- capital social: 200 lei, integral vărsat, total părţi sociale: 20 a câte 10 lei fiecare, cota de participare la beneficii: 100%, cota de participare la pierderi: 100%\n- fondator: NEDELCU VALENTIN, cu domiciliul în Bucureşti, sectorul 6, strada Vasile Golcea nr. 18-20, bloc 1, scara 1, etaj 2, ap. 9\n- administrator: NEDELCU VALENTIN, puteri conferite: depline, cu domiciliul în Bucureşti, sectorul 6, str. Vasile Golcea nr. 18-20, bloc 1, scara 1, etaj 2, ap. 9\n- durata de funcţionare: nelimitată.\nDispune publicarea în Monitorul Oficial al României, Partea a IV-a, a prezentului extras.\n(16/6.476.766)",
  "bulletin_id": null,
  "article_id": null,
  "list_parent_classes": null,
  "collapse_id": null,
  "source_href": null
}