{
  "type": "Notificare",
  "number": "1853",
  "date": "10.05.2021",
  "year": "2021",
  "company_name": "Societatea EVAL-EXPERT SPRIA - S.R.L.",
  "meta": {
    "cui": "22863266",
    "legal_type": "SRL",
    "reg_number": "J24/2175/2007",
    "euid": "ROONRC.J24",
    "caen": [],
    "capital": null,
    "address": null
  },
  "raw_text": "Societatea EVAL-EXPERT SPRIA - S.R.L.\nNOTIFICARE\nOficiul Registrului Comerţului de pe lângă Tribunalul Maramureş notifică, în conformitate cu prevederile art. 204 alin. (5) din Legea nr. 31/1990, republicată, cu modificările şi completările ulterioare, depunerea statutului actualizat al Societăţii Comerciale EVAL- EXPERT SPRIA - S.R.L., cu sediul în loc. Baia Sprie, oraşul Baia Sprie, strada George Coşbuc nr. 137, judeţul Maramureş, înregistrată sub nr. J24/2175/2007, identificator unic la nivel european ROONRC.J24/2175/2007, cod unic de înregistrare 22863266, care a fost înregistrat sub nr. 10183 din 16.03.2021.\n(5/6.476.073)",
  "bulletin_id": null,
  "article_id": null,
  "list_parent_classes": null,
  "collapse_id": null,
  "source_href": null
}