{
  "type": null,
  "number": "1853",
  "date": "10.05.2021",
  "year": "2021",
  "company_name": "Societatea ENJOY HOSTEL - S.R.L.",
  "meta": {
    "cui": "38402021",
    "legal_type": "SRL",
    "reg_number": "J12/6172/2017",
    "euid": null,
    "caen": [],
    "capital": null,
    "address": "în mun. Curtea de Argeş, jud. Argeş, la 15.08.1978"
  },
  "raw_text": "Societatea ENJOY HOSTEL - S.R.L.\nHOTĂRÂREA NR. 1 din 08.04.2021\na asociaţilor, la contractul şi statutul Societăţii ENJOY HOSTEL - S.R.L.\nŞI CONTRACT DE CESIUNE\n1. LAPUSTE FLAVIUS-MARIAN, cetăţean român, născut în mun. Curtea de Argeş, jud. Argeş, la 15.08.1978, domiciliat în Cluj-Napoca, Str. Plopilor nr. 75, ap. 9, identificat prin CI seria PA nr. 915740, eliberată de Pol. Cluj la 31.08.2020, CNP xxxxxxxxxxxxx;\n2. MOLDOVAN OVIDIU-STELIAN, cetăţean român, născut în mun. Bistriţa, jud. Bistriţa-Năsăud, la 16.08.1982, dom. în jud. Cluj, mun. Cluj-Napoca, str. Diaconu Coresi nr. 5, identificat prin CI seria CJ nr. 428394, eliberată de SPCJEP Cluj, la 22.07.2019, CNP xxxxxxxxxxxxx,\nasociaţi ai Societăţii \"ENJOY HOSTEL\" - S.R.L., cu sediul în jud. Cluj, mun. Cluj-Napoca, Str. Plopilor nr. 75, ap. 9, având un capital social de 200 RON, înmatriculată la ORC - Cluj sub nr. J12/6172/2017, CUI 38402021, am convenit perfectarea următorului contract de cesiune:\n1. Subsemnatul, MOLDOVAN OVIDIU-STELIAN, am hotărât să mă retrag din societate, cedând la valoarea nominală 10 părţi sociale a 10 RON, în valoare de 100 RON, în favoarea domnului LAPUSTE FLAVlUS- MARlAN. Cedentul declară că nu are nicio pretenţie faţă de societate şi faţă de cesionar.\nII. În urma cesiunii, contractul de societate a rămas fără obiect, iar statutul societăţii comportă următoarele modificări şi completări: participarea la capitalul social, părţi sociale, profit şi pierderi:\n- Asociat unic este LAPUSTE FLAVIUS-MARIAN, cetăţean român, născut în mun. Curtea de Argeş, jud. Argeş, la 15.08.1978, domiciliat în Cluj-Napoca, Str. Plopilor nr. 75, ap. 9, identificat prin CI seria PA nr. 915740, eliberată de Pol. Cluj, la 31.08.2020, CNP xxxxxxxxxxxxx;\n- Capitalul social subscris şi vărsat este de 200 RON, împărţit în 20 părţi sociale a 10 RON fiecare, aparţinând asociatului unic LAPUSTE FLAVIUS-MARlAN, căruia îi revin beneficiile sau eventualele pierderi.\nRestul clauzelor din statut rămân nemodificate. Actul constitutiv actualizat este anexat prezentei hotărâri.\n(26/6.514.794)",
  "bulletin_id": null,
  "article_id": null,
  "list_parent_classes": null,
  "collapse_id": null,
  "source_href": null
}