{
  "type": "Notificare",
  "number": "1853",
  "date": "10.05.2021",
  "year": "2021",
  "company_name": "Societatea KAIZEN CONSTRUCT - S.R.L.",
  "meta": {
    "cui": "33674580",
    "legal_type": "SRL",
    "reg_number": "J12/2938/2014",
    "euid": "ROONRC.J12",
    "caen": [],
    "capital": null,
    "address": "în municipiul Cluj- Napoca, strada Bună Ziua nr. 34-36, etaj 2, ap. 4, judeţul Cluj"
  },
  "raw_text": "Societatea KAIZEN CONSTRUCT - S.R.L.\nNOTIFICARE\nOficiul Registrului Comerţului de pe lângă Tribunalul Cluj notifică, în conformitate cu prevederile art. 204 alin. (5) din Legea nr. 31/1990, republicată, cu modificările şi completările ulterioare, depunerea textului actualizat al actului constitutiv al Societăţii Comerciale KAIZEN CONSTRUCT - S.R.L., cu sediul în municipiul Cluj- Napoca, strada Bună Ziua nr. 34-36, etaj 2, ap. 4, judeţul Cluj, înregistrată sub nr. J12/2938/2014, identificator unic la nivel european ROONRC.J12/2938/2014, cod unic de înregistrare 33674580, care a fost înregistrat sub nr. 31466 din 12.04.2021.\n(28/6.514.797)",
  "bulletin_id": null,
  "article_id": null,
  "list_parent_classes": null,
  "collapse_id": null,
  "source_href": null
}