{
  "type": null,
  "number": "1853",
  "date": "10.05.2021",
  "year": "2021",
  "company_name": "Societatea HOME MAGAZIN - S.R.L.",
  "meta": {
    "cui": "43924170",
    "legal_type": "SRL",
    "reg_number": "J40/4742/2021",
    "euid": "ROONRC.J40",
    "caen": [
      "4791"
    ],
    "capital": "200 lei, integral vărsat, total părţi sociale: 20 a câte 10 lei fiecare",
    "address": null
  },
  "raw_text": "Societatea HOME MAGAZIN - S.R.L.\nROMÂNIA\nMINISTERUL JUSTIŢIEI\nOFICIUL NAŢIONAL AL REGISTRULUI COMERŢULUI\nOFICIUL REGISTRULUI COMERŢULUI DE PE LÂNGĂ TRIBUNALUL BUCUREŞTI\nEXTRAS AL REZOLUŢIEI NR. 36721/16.03.2021\nPreda Anişoara - Persoana desemnată conform art. 11 alin. (1) din O.U.G. nr. 116/2009 pentru instituirea unor măsuri privind activitatea de înregistrare în registrul comerţului, aprobată cu modificări şi completări prin Legea nr. 84/2010, cu modificările şi completările ulterioare\nÎn baza cererii nr. 88846 din data de 15.03.2021 şi a actelor doveditoare depuse, persoana desemnată la Oficiul Registrului Comerţului de pe lângă Tribunalul Bucureşti a dispus autorizarea constituirii, înmatricularea şi înregistrarea societăţii:\n- denumire şi formă juridică: HOME MAGAZIN - S.R.L. cod unic de înregistrare: 43924170\n- identificator unic la nivel european (EUID): ROONRC.J40/4742/2021\n- număr de ordine în registrul comerţului:. J40/4742/2021\n- sediul social: Bucureşti, sectorul 2, strada Lt. Sachelarie Visarion nr. 51, camera 1, etaj 2, ap. 3\n- domeniul principal de activitate: grupa CAEN:\n479 - Comerţ cu amănuntul care nu se efectuează prin magazine, standuri, chioşcuri şi pieţe\n- activitate principală:\n4791 - Comerţ cu amănuntul prin intermediul caselor de comenzi sau prin internet\n- capital social: 200 lei, integral vărsat, total părţi sociale: 20 a câte 10 lei fiecare\n- fondatori:\n1. LAZĂR COSTIN, cu domiciliul în Bucureşti, sectorul 2, strada Lt. Sachelarie Visarion nr. 51, etaj 2, ap. 3\n2. NIŢU LAURENŢIU GABRIEL, cu domiciliul în Bucureşti, sectorul 3, bulevardul Camil Ressu nr. 70, bloc PM26, scara A, etaj 3, ap. 14\n- administratori:\n1. LAZĂR COSTIN, puteri conferite: depline, cu domiciliul în Bucureşti, sectorul 2, strada Lt. Sachelarie Visarion nr. 51, etaj 2, ap. 3\n2. NIŢU LAURENŢIU GABRIEL, puteri conferite: depline, cu domiciliul Bucureşti, sectorul 3, bulevardul Camil Ressu nr. 70, bloc PM26, scara A, etaj 3, ap. 14\n- durata de funcţionare: nedeterminată.\nDispune publicarea în Monitorul Oficial al României, Partea a IV-a, a prezentului extras.\n(18/6.476.768)",
  "bulletin_id": null,
  "article_id": null,
  "list_parent_classes": null,
  "collapse_id": null,
  "source_href": null
}