{
  "type": null,
  "number": "1853",
  "date": "10.05.2021",
  "year": "2021",
  "company_name": "Societatea ROUBC - S.R.L.",
  "meta": {
    "cui": "43933771",
    "legal_type": "SRL",
    "reg_number": "J23/1727/2021",
    "euid": "ROONRC.J23",
    "caen": [
      "8230"
    ],
    "capital": "200 lei, integral vărsat, total părţi sociale: 20 a câte 10 lei fiecare",
    "address": null
  },
  "raw_text": "Societatea ROUBC - S.R.L.\nROMÂNIA\nMINISTERUL JUSTIŢIEI\nOFICIUL NAŢIONAL AL REGISTRULUI COMERŢULUI\nOFICIUL REGISTRULUI COMERŢULUI DE PE LÂNGĂ TRIBUNALUL ILFOV\nEXTRAS AL REZOLUŢIEI NR. 8517/17.03.2021\nMaricela Barbu - Persoană desemnată conform art. 11 alin. (1) din O.U.G. nr. 116/2009 pentru instituirea unor măsuri privind activitatea de înregistrare în registrul comerţului, aprobată cu modificări şi completări prin Legea nr. 84/2010, cu modificările şi completările ulterioare\nÎn baza cererii nr. 15843 din data de 02.03.2021 şi a actelor doveditoare depuse, persoana desemnată la Oficiul Registrului Comerţului de pe lângă Tribunalul Ilfov a dispus autorizarea constituirii, înmatricularea şi înregistrarea societăţii:\n- denumire şi formă juridică: ROUBC - S.R.L.;\n- cod unic de înregistrare: 43933771;\n- identificator unic la nivel european (EUID): ROONRC.J23/1727/2021;\n- număr de ordine în registrul comerţului: J23/1727/2021;\n- sediul social: oraşul Voluntari, Şoseaua Bucureşti Nord nr. 10B, corp B2, SCARA A, etaj 3, ap. 444, judeţul Ilfov;\n- domeniul principal de activitate: grupa CAEN:\n823 - Activităţi de organizare a expoziţiilor, târgurilor şi congreselor;\n- activitate principală:\n8230 - Activităţi de organizare a expoziţiilor, târgurilor şi congreselor;\n- capital social: 200 lei, integral vărsat, total părţi sociale: 20 a câte 10 lei fiecare;\n- fondatori:\n1. MIHĂLĂCHIOIU VLAD, cu domiciliul în Bucureşti, sectorul 6, Strada Grinţieşului nr. 3, bloc P32, scara 1, etaj 4, ap. 17.\n2. BRÎNZĂ CRISTIAN, cu domiciliul în Bucureşti, sectorul 1, Strada Avionului nr. 52-70, bloc H, scara 1, etaj 1, ap. 7;\n- administrator:\n1. MIHĂLĂCHIOIU VLAD, puteri conferite: depline, exercitate separat, cu domiciliul în Bucureşti, sectorul 6, Strada Grinţieşului nr. 3, bloc P32, scara 1, etaj 4, ap. 17.\n2. BRÎNZĂ CRISTIAN, puteri conferite: depline, exercitate separat, cu domiciliul în Bucureşti, sectorul 1, Strada Avionului nr. 52-70, bloc H, scara 1, etaj 1, ap. 7;\n- durata de funcţionare: nelimitată.\nDispune publicarea în Monitorul Oficial al României, Partea a IV-a, a prezentului extras.\n(4/6.476.031)",
  "bulletin_id": null,
  "article_id": null,
  "list_parent_classes": null,
  "collapse_id": null,
  "source_href": null
}