{
  "type": null,
  "number": "1853",
  "date": "10.05.2021",
  "year": "2021",
  "company_name": "Societatea EQINILET CONSULTING - S.R.L.",
  "meta": {
    "cui": "43924161",
    "legal_type": "SRL",
    "reg_number": "J40/4746/2021",
    "euid": "ROONRC.J40",
    "caen": [
      "6201"
    ],
    "capital": "200 lei, integral vărsat, total părţi sociale: 20 a câte 10 lei fiecare",
    "address": null
  },
  "raw_text": "Societatea EQINILET CONSULTING - S.R.L.\nROMÂNIA\nMINISTERUL JUSTIŢIEI\nOFICIUL NAŢIONAL AL REGISTRULUI COMERŢULUI\nOFICIUL REGISTRULUI COMERŢULUI DE PE LÂNGĂ TRIBUNALUL BUCUREŞTI\nEXTRAS AL REZOLUŢIEI NR. 36138/16.03.2021\nEmma Mădălina Leonida - Persoana desemnată conform art. 11 alin. (1) din O.U.G. nr. 116/2009 pentru instituirea unor măsuri privind activitatea de înregistrare în registrul comerţului, aprobată cu modificări şi completări prin Legea nr. 84/2010, cu modificările şi completările ulterioare\nÎn baza cererii nr. 86151 din data de 12.03.2021 şi a actelor doveditoare depuse, persoana desemnată la Oficiul Registrului Comerţului de pe lângă Tribunalul Bucureşti a dispus autorizarea constituirii, înmatricularea şi înregistrarea societăţii:\n- denumire şi formă juridică: EQINILET CONSULTING - S.R.L.\n- cod unic de înregistrare: 43924161\n- identificator unic la nivel european (EUID): ROONRC.J40/4746/2021\n- număr de ordine în registrul comerţului: J40/4746/2021\n- sediul social: Bucureşti, sectorul 3, Bulevardul Unirii nr. 61, bloc F3, scara 4, etaj 2, ap. 208\n- domeniul principal de activitate: grupa CAEN:\n620 - Activităţi de servicii în tehnologia informaţiei\n- activitate principală:\n6201 - Activităţi de realizare a soft-ului la comandă (software orientat client)\n- capital social: 200 lei, integral vărsat, total părţi sociale: 20 a câte 10 lei fiecare\n- fondator: MORAKE LLEWELLYN-QUINLAN, cu domiciliul în municipiul Piatra Neamţ, strada Anton Vorel nr. 1, bloc B2, scara A, ap. 1, judeţul Neamţ\n- administrator: MORAKE LLEWELLYN-QUINLAN, puteri conferite: depline, cu domiciliul în municipiul Piatra Neamţ, strada Anton Vorel nr. 1, bloc B2, scara A, ap. 1, judeţul Neamţ\n- durata de funcţionare: nelimitată.\nDispune publicarea în Monitorul Oficial al României, Partea a IV-a, a prezentului extras.\n(20/6.476.771)",
  "bulletin_id": null,
  "article_id": null,
  "list_parent_classes": null,
  "collapse_id": null,
  "source_href": null
}