{
  "type": "Notificare",
  "number": "1853",
  "date": "10.05.2021",
  "year": "2021",
  "company_name": "Societatea ASR BUCOVINA - S.R.L.",
  "meta": {
    "cui": "43195968",
    "legal_type": "SRL",
    "reg_number": "J33/1359/2020",
    "euid": "ROONRC.J33",
    "caen": [],
    "capital": null,
    "address": "în municipiul Suceava, strada Iancu Flondor nr. 2, judeţul Suceava"
  },
  "raw_text": "Societatea ASR BUCOVINA - S.R.L.\nNOTIFICARE\nOficiul Registrului Comerţului de pe lângă Tribunalul Suceava notifică, în conformitate cu prevederile art. 204 alin. (5) din Legea nr. 31/1990, republicată, cu modificările şi completările ulterioare, depunerea textului actualizat al actului constitutiv al societăţii comerciale ASR BUCOVINA - S.R.L., cu sediul în municipiul Suceava, strada Iancu Flondor nr. 2, judeţul Suceava, înregistrată sub nr. J33/1359/2020, identificator unic la nivel european ROONRC.J33/1359/2020, cod unic de înregistrare 43195968, care a fost înregistrat sub nr. 14074 din 13.04.2021.\n(23/6.518.350)",
  "bulletin_id": null,
  "article_id": null,
  "list_parent_classes": null,
  "collapse_id": null,
  "source_href": null
}