{
  "type": null,
  "number": "1853",
  "date": "10.05.2021",
  "year": "2021",
  "company_name": "Societatea OMEGA TRAINING & MANAGEMENT - S.R.L.",
  "meta": {
    "cui": "27769473",
    "legal_type": "SRL",
    "reg_number": "J12/408/2010",
    "euid": null,
    "caen": [],
    "capital": null,
    "address": "în mun. Bucureşti, Şoseaua Virtuţii nr. 19D, et. 3, sectorul 6"
  },
  "raw_text": "Societatea OMEGA TRAINING & MANAGEMENT - S.R.L.\nDECIZIA din data de 08.04.2021\na asociatului unic al OMEGA TRAINING & MANAGEMENT - S.R.L.\nSubscrisa, HARRISON CONSULTING & MANAGEMENT - S.R.L., persoană juridică română, cu sediul în mun. Bucureşti, Şoseaua Virtuţii nr. 19D, et. 3, sectorul 6, înregistrată la ORCT Bucureşti sub nr. J40/11781/02.12.2010, având CUI 27769473, prin administrator ŞELARU CARMEN FLORENTINA,\nîn calitate de asociat unic al OMEGA TRAINING & MANAGEMENT - S.R.L., persoană juridică română, cu sediul în mun. Cluj-Napoca, Calea Dorobanţilor nr. 14-16, sc. B, et. 4, ap. 34, judeţul Cluj, înmatriculată la ORCT Cluj sub nr. J12/408/2010, având CUI 26645620, am hotărât următoarele:\n1. Dizolvarea Societăţii OMEGA TRAINING & MANAGEMENT - S.R.L., precum şi lichidarea sa simultană, în temeiul dispoziţiilor art. 235 din Legea nr. 31/1990, în vederea radierii acesteia.\n2. Societatea nu are datorii şi nici creanţe, iar activele rămase se transmit asociatului unic HARRISON CONSULTING & MANAGEMENT - S.R.L. în proporţie de 100%.\n(25/6.514.793)",
  "bulletin_id": null,
  "article_id": null,
  "list_parent_classes": null,
  "collapse_id": null,
  "source_href": null
}