{
  "type": null,
  "number": "1853",
  "date": "10.05.2021",
  "year": "2021",
  "company_name": "Societatea DARON FUEL SOLUTIONS - S.R.L.",
  "meta": {
    "cui": "43933887",
    "legal_type": "SRL",
    "reg_number": "J23/1723/2021",
    "euid": "ROONRC.J23",
    "caen": [
      "8299"
    ],
    "capital": "200 lei, integral vărsat, total părţi sociale: 20 a câte 10 lei fiecare",
    "address": null
  },
  "raw_text": "Societatea DARON FUEL SOLUTIONS - S.R.L.\nROMÂNIA\nMINISTERUL JUSTIŢIEI\nOFICIUL NAŢIONAL AL REGISTRULUI COMERŢULUI\nOFICIUL REGISTRULUI COMERŢULUI DE PE LÂNGĂ TRIBUNALUL ILFOV\nEXTRAS AL REZOLUŢIEI NR. 8534/17.03.2021\nDenise-Georgiana Rancu - Persoană desemnată conform art. 11 alin. (1) din O.U.G. nr. 116/2009 pentru instituirea unor măsuri privind activitatea de înregistrare în registrul comerţului, aprobată cu modificări şi completări prin Legea nr. 84/2010, cu modificările şi completările ulterioare\nÎn baza cererii nr. 20188 din data de 15.03.2021 şi a actelor doveditoare depuse, persoana desemnată la Oficiul Registrului Comerţului de pe lângă Tribunalul Ilfov a dispus autorizarea constituirii, înmatricularea şi înregistrarea societăţii:\n- denumire şi formă juridică: DARON FUEL SOLUTIONS - S.R.L.;\n- cod unic de înregistrare: 43933887;\n- identificator unic la nivel european (EUID): ROONRC.J23/1723/2021;\n- număr de ordine în registrul comerţului: J23/1723/2021;\n- sediul social: satul Dudu, comuna Chiajna, Strada Tineretului nr. 19, bloc 4, etaj 3, ap. 74, judeţul Ilfov;\n- domeniul principal de activitate: grupa CAEN:\n829 - Activităţi de servicii suport pentru întreprinderi n.c.a.;\n- activitate principală:\n8299 - Alte activităţi de servicii suport pentru întreprinderi n.c.a.;\n- capital social: 200 lei, integral vărsat, total părţi sociale: 20 a câte 10 lei fiecare;\n- fondator: BOMBOŞ-STANESCU SILVIU- BOGDANEL, cu domiciliul în Bucureşti, sectorul 1, Drumul Costeşti nr. 8;\n- administrator: BOMBOŞ-STANESCU SILVIU- BOGDANEL, puteri conferite: depline, cu domiciliul în Bucureşti, sectorul 1, Drumul Costeşti nr. 8;\n- durata de funcţionare: nedeterminată.\nDispune publicarea în Monitorul Oficial al României, Partea a IV-a, a prezentului extras.\n(3/6.476.028)",
  "bulletin_id": null,
  "article_id": null,
  "list_parent_classes": null,
  "collapse_id": null,
  "source_href": null
}